reference,name,latitude,longitude,grid,locationDesc,attempts,activations,qsos,my_activations,my_hunted_qsos
JA-0001,Rishiri-Rebun-Sarobetsu National Park,45.1942,141.239,QN05oe,JP-HK,12,10,390,0,1
JA-0002,Shiretoko National Park,44.165,145.205,QN24od,JP-HK,4,4,104,0,0
JA-0003,Akan-Mashu National Park,43.4362,144.103,QN23bk,JP-HK,9,8,265,0,0
JA-0004,Kushiroshitsugen National Park,43.1383,144.445,QN23fd,JP-HK,18,17,491,0,1
JA-0005,Daisetsuzan National Park,43.6717,142.907,QN13kq,JP-HK,19,18,493,0,0
JA-0006,Shikotsu-Toya National Park,42.7959,141.221,QN02ot,JP-HK,28,24,626,0,0
JA-0007,Towada-Hachimantai National Park,40.2442,140.939,QN00lf,"JP-AK,JP-AO,JP-IW",34,23,647,0,1
JA-0008,Sanriku Fukko National Park,39.0046,141.585,QM09ta,"JP-AO,JP-IW,JP-MG",153,143,4848,0,8
JA-0009,Bandai-Asahi National Park,37.8229,139.74,PM97ut,"JP-FS,JP-NI,JP-YT",105,87,3050,0,2
JA-0010,Nikko National Park,36.8763,139.464,PM96rv,"JP-FS,JP-GM,JP-TC",153,134,5830,0,5
JA-0011,Oze National Park,36.9382,139.287,PM96pw,"JP-FS,JP-GM,JP-NI,JP-TC",24,24,742,0,0
JA-0012,Joshinetsu Kogen National Park,36.6919,138.519,PM96gq,"JP-GM,JP-NI,JP-NN",193,174,4509,0,1
JA-0013,Myoko-Togakushi renzan National Park,36.8364,138.077,PM96au,"JP-NI,JP-NN",47,43,1111,0,2
JA-0014,Chichibu-Tama-Kai National Park,35.8593,138.863,PM95ku,"JP-NN,JP-ST,JP-TK,JP-YN",515,455,22961,0,24
JA-0015,Ogasawara National Park,27.0671,142.211,QL17cb,JP-TK,13,7,447,0,3
JA-0016,Fuji-Hakone-Izu National Park,35.2347,139.022,PM95mf,"JP-KN,JP-SZ,JP-TK,JP-YN",1015,763,26412,0,17
JA-0017,Chubusangaku National Park,36.449,137.622,PM86tk,"JP-GF,JP-NI,JP-NN,JP-TY",82,67,1517,0,0
JA-0018,Hakusan National Park,36.1579,136.765,PM86jd,"JP-FI,JP-GF,JP-IS,JP-TY",19,19,485,0,0
JA-0019,Minami Alps National Park,35.6421,138.217,PM95cp,"JP-NN,JP-SZ,JP-YN",17,12,342,0,0
JA-0020,Ise-Shima National Park,34.426,136.802,PM84jk,JP-ME,23,18,570,0,1
JA-0021,Yoshino-Kumano National Park,33.6542,135.659,PM73tp,"JP-ME,JP-NR,JP-WK",46,45,1975,0,1
JA-0022,San'inkaigan National Park,35.6485,134.65,PM75hp,"JP-HG,JP-KY,JP-TT",19,19,1347,0,0
JA-0023,Setonaikai National Park,34.2796,133.229,PM64og,"JP-EH,JP-FO,JP-HG,JP-HS,JP-KG,JP-OS,JP-OT,JP-OY,JP-TS,JP-WK,JP-YC",299,270,10689,0,18
JA-0024,Daisen-Oki National Park,35.4072,133.543,PM65sj,"JP-OY,JP-SM,JP-TT",31,26,1614,0,0
JA-0025,Ashizuri-Uwakai National Park,32.7791,132.979,PM62ls,"JP-EH,JP-KC",11,10,484,0,0
JA-0026,Saikai National Park,33.1642,129.677,PM43ud,JP-NS,8,6,168,0,0
JA-0027,Unzen-Amakusa National Park,32.7105,130.273,PM52dr,"JP-KM,JP-KS,JP-NS",11,9,184,0,0
JA-0028,Aso-Kuju National Park,32.9499,131.086,PM52nw,"JP-KM,JP-OT",45,38,1908,0,1
JA-0029,Kirishima-Kinkowan National Park,31.9211,130.877,PM51kw,"JP-KS,JP-MZ",24,20,680,0,1
JA-0030,Yakushima (Island) National Park,30.3261,130.53,PM50gh,JP-KS,0,0,0,0,0
JA-0031,Amamigunto National Park,28.2426,129.309,PL48pf,JP-KS,11,10,527,0,0
JA-0032,Yambaru National Park,26.7286,128.221,PL46cr,JP-ON,3,3,124,0,0
JA-0033,Keramashoto National Park,26.202,127.36,PL36qe,JP-ON,2,1,13,0,0
JA-0034,Iriomote-Ishigaki National Park,24.3515,123.924,PL14xi,JP-ON,52,21,999,0,0
JA-0101,Shokanbetsu-Teuri-Yagishiri Quasi-National Park,43.7292,141.542,QN03sr,JP-HK,7,6,213,0,0
JA-0102,Abashiri Quasi-National Park,44.1892,143.748,QN14ue,JP-HK,10,10,328,0,0
JA-0103,Niseko-Shakotan-Otaru Kaigan Quasi-National Park,42.8973,140.57,QN02gv,JP-HK,9,9,508,0,0
JA-0104,Hidaka Sanmyaku-Erimo Quasi-National Park,42.4067,142.918,QN12lj,JP-HK,7,7,383,0,0
JA-0105,Onuma Quasi-National Park,41.9858,140.669,QN01ix,JP-HK,4,4,191,0,0
JA-0106,Shimokita Hanto Quasi-National Park,41.3286,141.06,QN01mh,JP-AO,6,6,257,0,0
JA-0107,Tsugaru Quasi-National Park,41.2536,140.345,QN01eg,JP-AO,10,9,291,0,0
JA-0108,Hayachine Quasi-National Park,39.5432,141.492,QM09rn,JP-IW,6,6,256,0,0
JA-0109,Kurikoma Quasi-National Park,38.9447,140.805,QM08jw,"JP-AK,JP-IW,JP-MG,JP-YT",25,24,1126,0,1
JA-0110,Zao Quasi-National Park,38.1479,140.45,QM08fd,"JP-MG,JP-YT",153,134,5050,0,11
JA-0111,Oga Quasi-National Park,39.8873,139.777,PM99vv,JP-AK,12,9,288,0,0
JA-0112,Chokai Quasi-National Park,39.0781,140.041,QM09ab,"JP-AK,JP-YT",22,17,659,0,1
JA-0113,Echigo sanzan-Tadami Quasi-National Park,37.2688,139.051,PM97mg,"JP-FS,JP-NI",33,30,1043,0,0
JA-0114,Suigo-Tsukuba Quasi-National Park,35.99,140.474,QM05fx,"JP-CH,JP-IB",220,170,10498,0,20
JA-0115,Myogi-Arafune-Saku Kogen Quasi-National Park,36.2934,138.842,PM96kh,"JP-GM,JP-NN",53,49,2307,0,2
JA-0116,Minami-Boso Quasi-National Park,35.1161,140.122,QM05bc,JP-CH,111,106,4444,0,3
JA-0117,Meiji no Mori Takao Quasi-National Park,35.6334,139.266,PM95pp,JP-TK,46,37,1238,0,17
JA-0118,Tanzawa-Oyama Quasi-National Park,35.4105,139.21,PM95oj,JP-KN,87,77,2563,0,3
JA-0119,Sado-Yahiko-Yoneyama Quasi-National Park,38.1614,138.324,PM98dd,JP-NI,13,12,452,0,0
JA-0120,Noto Hanto Quasi-National Park,37.5256,137.257,PM87pm,"JP-IS,JP-TY",41,39,1223,0,1
JA-0121,Echizen-Kaga Kaigan Quasi-National Park,36.249,136.199,PM86cf,"JP-FI,JP-IS",13,13,465,0,0
JA-0122,Wakasa Wan Quasi-National Park,35.5781,135.875,PM75wn,"JP-FI,JP-KY",39,37,3666,0,0
JA-0123,Yatsugatake-Chushin Kogen Quasi-National Park,35.9981,138.358,PM95ex,"JP-NN,JP-YN",324,285,8516,0,15
JA-0124,Chuo Alps Quasi-National Park,35.7901,137.811,PM85vs,JP-NN,22,21,567,0,0
JA-0125,Tenryu-Okumikawa Quasi-National Park,35.1872,137.757,PM85ve,"JP-AI,JP-NN,JP-SZ",48,45,1211,0,1
JA-0126,Ibi-Sekigahara-Yoro Quasi-National Park,35.2942,136.509,PM85gh,JP-GF,148,112,7551,0,0
JA-0127,Hida-Kisogawa Quasi-National Park,35.7334,137.203,PM85or,"JP-AI,JP-GF",31,29,787,0,1
JA-0128,Aichi Kogen Quasi-National Park,35.0331,137.41,PM85qa,JP-AI,46,39,1191,0,1
JA-0129,Mikawa Wan Quasi-National Park,34.8155,137.233,PM84ot,JP-AI,131,116,2693,0,2
JA-0130,Suzuka Quasi-National Park,35.0769,136.339,PM85eb,"JP-ME,JP-SH",26,26,613,0,0
JA-0131,Muro-Akame-Aoyama Quasi-National Park,34.5597,136.092,PM84bn,"JP-ME,JP-NR",61,56,3529,0,1
JA-0132,Biwako Quasi-National Park,35.2377,136.166,PM85bf,"JP-KY,JP-SH",101,84,2604,0,2
JA-0133,Tango-Amanohashidate-Oeyama Quasi-National Park,35.5669,135.19,PM75on,JP-KY,24,22,1569,0,0
JA-0134,Kyoto Tamba Kogen Quasi-National Park,35.2765,135.589,PM75tg,JP-KY,14,14,444,0,0
JA-0135,Meiji no Mori Mino Quasi-National Park,34.8577,135.478,PM74ru,JP-OS,22,21,556,0,0
JA-0136,Kongo-Ikoma-Kisen Quasi-National Park,34.4607,135.687,PM74ul,"JP-NR,JP-OS,JP-WK",174,161,3910,0,3
JA-0137,Hyonosen-Ushiroyama-Nagisan Quasi-National Park,35.4969,134.471,PM75fl,"JP-HG,JP-OY,JP-TT",16,16,530,0,0
JA-0138,Yamato-Aogaki Quasi-National Park,34.5394,135.857,PM74wm,JP-NR,11,11,392,0,0
JA-0139,Koya-Ryujin Quasi-National Park,34.0765,135.56,PM74sb,"JP-NR,JP-WK",41,40,960,0,0
JA-0140,Hiba-Dogo-Taishaku Quasi-National Park,35.0732,133.057,PM65mb,"JP-HS,JP-SM,JP-TT",13,12,433,0,0
JA-0141,Nishi-Chugoku Sanchi Quasi-National Park,34.5624,132.025,PM64an,"JP-HS,JP-SM,JP-YC",16,16,1218,0,0
JA-0142,Kita-Nagato Kaigan Quasi-National Park,34.5321,131.499,PM54rm,JP-YC,12,12,1122,0,0
JA-0143,Akiyoshidai Quasi-National Park,34.2499,131.304,PM54pf,JP-YC,9,9,574,0,5
JA-0144,Tsurugisan Quasi-National Park,33.9177,133.805,PM63vw,"JP-KC,JP-TS",11,7,178,0,0
JA-0145,Muroto-Anan Kaigan Quasi-National Park,33.8353,134.747,PM73iu,"JP-KC,JP-TS",50,50,3207,0,0
JA-0146,Ishizuchi Quasi-National Park,33.7667,133.114,PM63ns,"JP-EH,JP-KC",5,5,141,0,0
JA-0147,Kitakyushu Quasi-National Park,33.8461,130.794,PM53ju,JP-FO,6,5,246,0,0
JA-0148,Genkai Quasi-National Park,33.58,130.097,PM53bn,"JP-FO,JP-NS,JP-SG",11,10,347,0,1
JA-0149,Yaba-Hita-Hikosan Quasi-National Park,33.5144,131.005,PM53mm,"JP-FO,JP-KM,JP-OT",12,11,483,0,0
JA-0150,Iki-Tsushima Quasi-National Park,33.7412,129.708,PM43ur,JP-NS,5,5,210,0,1
JA-0151,Kyushu Chuo Sanchi Quasi-National Park,32.5319,131.023,PM52mm,"JP-KM,JP-MZ",2,2,69,0,0
JA-0152,Nippo Kaigan Quasi-National Park,33.0578,132.007,PM63ab,"JP-MZ,JP-OT",19,16,843,0,1
JA-0153,Sobo-Katamuki Quasi-National Park,32.8359,131.431,PM52ru,"JP-MZ,JP-OT",6,4,202,0,0
JA-0154,Nichinan Kaigan Quasi-National Park,31.8034,131.469,PM51rt,"JP-KS,JP-MZ",41,39,1218,0,2
JA-0155,Koshikishima Quasi-National Park,31.8617,129.877,PM41wu,JP-KS,0,0,0,0,0
JA-0156,Okinawa Kaigan Quasi-National Park,26.778,128.213,PL46cs,JP-ON,14,13,583,0,1
JA-0157,Okinawa Senseki Quasi-National Park,26.088,127.699,PL36uc,JP-ON,6,5,114,0,0
JA-0201,Takino Suzuran Hillside National Government Park,42.9109,141.38,QN02qv,JP-HK,3,3,37,0,0
JA-0202,Michinoku Lakewood National Government Park,38.1848,140.672,QM08ie,JP-MG,17,17,538,0,0
JA-0203,Hitachi Seaside National Government Park,36.4029,140.598,QM06hj,JP-IB,11,10,211,0,1
JA-0204,Musashi-Kyuryo National Government Park,36.0836,139.369,PM96qc,JP-ST,14,14,374,0,0
JA-0205,Showa Kinen National Government Park,35.7108,139.396,PM95qr,JP-TK,51,39,888,0,4
JA-0206,The Tokyo Rinkai Disaster Prevention National Government Park,35.6355,139.796,PM95vp,JP-TK,44,38,579,0,2
JA-0207,Echigo Hillside National Government Park,37.4174,138.746,PM97ik,JP-NI,8,7,185,0,0
JA-0208,Alps Azumino National Government Park,36.315,137.842,PM86wh,JP-NN,38,38,861,0,2
JA-0209,Kiso Sansen National Government Park,35.3578,136.813,PM85ji,"JP-AI,JP-GF,JP-ME",107,86,2602,0,5
JA-0210,Yodogawa Riverside National Government Park,34.7446,135.558,PM74sr,"JP-KY,JP-OS",29,28,648,0,0
JA-0211,Akashi Kaikyo National Government Park,34.5628,135.011,PM74mn,JP-HG,6,6,123,0,0
JA-0213,Asuka Historical National Government Park,34.4654,135.804,PM74vl,JP-NR,16,16,311,0,2
JA-0214,Bihoku Hillside National Government Park,34.8385,132.997,PM64lu,JP-HS,6,6,157,0,0
JA-0215,Sanuki Manno National Government Park,34.1648,133.891,PM64wd,JP-KG,5,5,130,0,0
JA-0216,Uminonakamichi Seaside National Government Park,33.655,130.356,PM53ep,JP-FO,6,6,134,0,0
JA-0217,Yoshinogari Historical National Government Park,33.3242,130.384,PM53eh,JP-SG,5,5,141,0,0
JA-0218,Okinawa Kinen National Government Park,26.6919,127.88,PL36wq,JP-ON,1,1,18,0,0
JA-1001,Akkeshi-Kiritappu-Konbumori Quasi-National Park,43.0169,144.838,QN23ka,JP-HK,9,7,389,0,0
JA-1002,Furano-Ashibetsu Prefectural Nature Park,43.2133,142.284,QN13df,JP-HK,20,20,426,0,1
JA-1003,Hiyama Prefectural Nature Park,41.8689,140.114,QN01bu,JP-HK,3,3,195,0,1
JA-1004,Esan Prefectural Nature Park,41.815,141.173,QN01ot,JP-HK,4,4,97,0,0
JA-1005,Notsuke-Furen Prefectural Nature Park,43.6049,145.284,QN23po,JP-HK,4,4,148,0,0
JA-1006,Matsumae-Yagoshi Prefectural Nature Park,41.3983,140.199,QN01cj,JP-HK,3,3,139,0,0
JA-1007,North Okhotsk Prefectural Nature Park,45.1472,142.37,QN15ed,JP-HK,2,2,127,0,0
JA-1008,Nopporo Shinrin Kouen Prefectural Nature Park,43.0525,141.501,QN03sb,JP-HK,8,8,227,0,1
JA-1009,Kariba-Motta Prefectural Nature Park,42.6097,139.853,PN92wo,JP-HK,2,2,69,0,0
JA-1010,Shumarinai Prefectural Nature Park,44.3083,142.181,QN14ch,JP-HK,4,4,273,0,1
JA-1011,Teshiodake Prefectural Nature Park,43.9875,142.861,QN13kx,JP-HK,2,2,105,0,0
JA-1012,Sharidake Prefectural Nature Park,43.7617,144.723,QN23is,JP-HK,2,2,77,0,0
JA-1013,Makomanai Prefectural Park,42.9957,141.344,QN02qx,JP-HK,5,5,86,0,0
JA-1014,Hokkaido kodomo no kuni Prefectural Park,43.524,141.94,QN03xm,JP-HK,7,6,178,0,0
JA-1015,Nopporo Sports Prefectural Park,43.0692,141.531,QN03sb,JP-HK,7,6,154,0,0
JA-1016,Okhotsk Prefectural Park,43.9902,144.243,QN23cx,JP-HK,7,5,113,0,0
JA-1017,Okhotsk Sea Ice Prefectural Park,44.3167,143.394,QN14qh,JP-HK,6,4,180,0,0
JA-1018,Soya Fureai Prefectural Park,45.3942,141.757,QN05vj,JP-HK,7,6,630,0,0
JA-1019,Sunpillar Prefectural Park,44.3739,142.479,QN14fi,JP-HK,2,2,42,0,0
JA-1020,Yumenomori Prefectural Park,43.5688,144.956,QN23ln,JP-HK,6,5,103,0,0
JA-1021,Tokachi Ecology Prefectural Park,42.9336,143.31,QN12pw,JP-HK,9,5,144,0,0
JA-1022,South Hokkaido Shiki no Mori Prefectural Park,41.8489,140.768,QN01ju,JP-HK,3,2,107,0,0
JA-1023,Volcano Bay Panorama Prefectural Park,42.2268,140.314,QN02df,JP-HK,4,4,161,0,0
JA-1024,Asamushi-Natsudomari Prefectural Nature Park,40.9981,140.893,QN00kx,JP-AO,6,6,315,0,0
JA-1025,Owani Ikarigaseki Onsenkyo Prefectural Nature Park,40.4092,140.644,QN00hj,JP-AO,4,4,143,0,0
JA-1026,Nakuidake Prefectural Nature Park,40.3879,141.308,QN00pj,JP-AO,4,4,149,0,0
JA-1027,Ashinochishogun Prefectural Nature Park,40.9136,140.452,QN00fv,JP-AO,3,3,143,0,0
JA-1028,Kuroishi Onsenkyo Prefectural Nature Park,40.5681,140.732,QN00in,JP-AO,4,4,234,0,0
JA-1029,Iwaki Kogen Prefectural Nature Park,40.6144,140.305,QN00do,JP-AO,3,3,138,0,0
JA-1030,Tsugaru Shirakami Prefectural Nature Park,40.6294,140.111,QN00bp,JP-AO,4,3,167,0,0
JA-1031,New Aomori Prefectural Sports Prefectural Park,40.8428,140.841,QN00ku,JP-AO,6,6,152,0,0
JA-1033,Hanamaki Onsenkyo Prefectural Nature Park,39.4489,141.073,QM09mk,JP-IW,9,9,342,0,0
JA-1034,Kuji-Hiraniwa Prefectural Nature Park,40.0839,141.508,QN00sc,JP-IW,5,5,219,0,0
JA-1035,Sotoyama-Hayasaka Heights Prefectural Nature Park,39.8183,141.378,QM09qt,JP-IW,8,7,269,0,0
JA-1036,Yuda Onsenkyo Prefectural Nature Park,39.3406,140.79,QM09ji,JP-IW,8,7,268,0,0
JA-1037,Orizume-Basenkyo Prefectural Nature Park,40.251,141.276,QN00pg,JP-IW,9,8,458,0,0
JA-1038,Goyozan Prefectural Nature Park,39.203,141.729,QM09ue,JP-IW,24,19,667,0,1
JA-1039,Murone Kogen Prefectural Nature Park,38.9739,141.446,QM08rx,JP-IW,15,11,269,0,0
JA-1040,Goshoko Koiki Prefectural Park,39.6676,140.978,QM09lq,JP-IW,12,11,533,0,0
JA-1041,Takizawa Forest Prefectural Park,39.8067,141.138,QM09nt,JP-IW,6,6,212,0,0
JA-1042,Hanamaki Koiki Prefectural Park,39.4335,141.056,QM09mk,JP-IW,8,8,178,0,0
JA-1043,Uchimaru Ryokuchi Prefectural Park,39.7026,141.153,QM09nq,JP-IW,6,6,125,0,0
JA-1044,Zao Kogen Prefectural Nature Park,38.0819,140.549,QM08gb,JP-MG,15,14,509,0,2
JA-1045,Abukuma Keikoku Prefectural Nature Park,37.8333,140.715,QM07it,JP-MG,15,15,607,0,0
JA-1046,Futakuchi Kyokoku Prefectural Nature Park,38.2737,140.601,QM08hg,JP-MG,17,17,642,0,0
JA-1047,Funagatarenpo Prefectural Nature Park,38.4503,140.631,QM08hk,JP-MG,20,20,598,0,2
JA-1048,Matsushima Prefectural Nature Park,38.3533,141.064,QM08mi,JP-MG,60,59,1476,0,0
JA-1049,Asahiyama Prefectural Nature Park,38.4883,141.181,QM08ol,JP-MG,9,8,326,0,0
JA-1050,Kenjosan Mangokuura Prefectural Nature Park,38.4058,141.401,QM08qj,JP-MG,32,27,1023,0,1
JA-1051,Kesennuma Prefectural Nature Park,38.8608,141.499,QM08ru,JP-MG,28,27,948,0,1
JA-1052,Matsushima Koen Prefectural Park,38.3661,141.061,QM08mi,JP-MG,18,18,429,0,0
JA-1053,Miyaginohara Prefectural Park,38.2564,140.902,QM08kg,JP-MG,21,20,385,0,0
JA-1054,Sendaiko Tagajo Chiku Kansho Ryokuchi Prefectural Park,38.2895,141.033,QM08mg,JP-MG,13,13,316,0,0
JA-1055,Yamoto Kaihin Ryokuchi Prefectural Park,38.4053,141.238,QM08oj,JP-MG,8,8,259,0,1
JA-1056,Iwanuma Kaihin Ryokuchi Prefectural Park,38.1187,140.932,QM08lc,JP-MG,16,16,308,0,0
JA-1057,Kasenuma Prefectural Park,38.3124,140.986,QM08lh,JP-MG,9,9,176,0,0
JA-1058,Miyagi Sports Prefectural Park,38.3354,140.953,QM08li,JP-MG,8,8,145,0,0
JA-1059,Hachimori Iwadate Prefectural Nature Park,40.37,140.01,QN00ai,JP-AK,5,4,134,0,0
JA-1060,Akita Shirakami Prefectural Nature Park,40.42,140.12,QN00bk,JP-AK,4,4,190,0,1
JA-1061,Tashirodake Prefectural Nature Park,40.43,140.41,QN00ek,JP-AK,3,3,201,0,0
JA-1062,Kimimachi-zaka Prefectural Nature Park,40.2214,140.256,QN00df,JP-AK,4,3,137,0,1
JA-1063,Moriyoshizan Prefectural Nature Park,39.98,140.54,QM09gx,JP-AK,4,4,254,0,0
JA-1064,Taiheizan Prefectural Nature Park,39.79,140.31,QM09ds,JP-AK,12,10,293,0,0
JA-1065,Tazawako Dakigaeri Prefectural Nature Park,39.73,140.66,QM09hr,JP-AK,13,12,422,0,0
JA-1066,Magi Mahiru Prefectural Nature Park,39.5375,140.69,QM09im,JP-AK,9,8,209,0,0
JA-1067,Akita Prefectural Central Prefectural Park,39.6231,140.204,QM09co,JP-AK,8,7,223,0,0
JA-1068,Hokuo no Mori Prefectural Park,40.1645,140.367,QN00ed,JP-AK,5,5,132,0,0
JA-1069,Koizumigata Prefectural Park,39.8136,140.07,QM09at,JP-AK,9,7,204,0,0
JA-1070,Shonai Kaihin Prefectural Nature Park,38.8513,139.787,PM98vu,JP-YT,16,16,569,0,1
JA-1071,Goshozan Prefectural Nature Park,38.4555,140.614,QM08hk,JP-YT,35,34,1416,0,2
JA-1072,Kennan Prefectural Nature Park,38.0034,140.205,QM08ca,JP-YT,17,16,741,0,3
JA-1073,Kabusan Prefectural Nature Park,38.9905,140.389,QM08ex,JP-YT,10,10,534,0,0
JA-1074,Tendo Kogen Prefectural Nature Park,38.349,140.452,QM08fi,JP-YT,84,84,3287,0,6
JA-1075,Mogamigawa Prefectural Nature Park,38.7565,140.051,QM08as,JP-YT,12,11,498,0,0
JA-1076,Yamagata Prefectural General Sports Prefectural Park,38.3361,140.377,QM08ei,JP-YT,70,69,2539,0,3
JA-1077,Nishizao Prefectural Park,38.205,140.355,QM08ee,JP-YT,22,20,783,0,2
JA-1078,Yumiharidaira Prefectural Park,38.4761,140.003,QM08al,JP-YT,11,11,388,0,1
JA-1079,Nakayama Prefectural Park,38.3421,140.267,QM08di,JP-YT,14,14,515,0,1
JA-1080,Mogamigawa Furusato Sogo Prefectural Park,38.3652,140.263,QM08di,JP-YT,20,16,545,0,0
JA-1081,Mogami Central Prefectural Park,38.7601,140.308,QM08ds,JP-YT,7,7,232,0,1
JA-1082,Zao Miharashi no Oka Museum Prefectural Park,38.1879,140.295,QM08de,JP-YT,15,13,438,0,0
JA-1083,Kenko no Mori Prefectural Park,38.3003,140.345,QM08eh,JP-YT,65,60,2295,0,4
JA-1084,Yuso no Oka Prefectural Park,38.2152,140.349,QM08ef,JP-YT,23,23,561,0,0
JA-1085,Shonai Kuko Kansho Ryokuchi Prefectural Park,38.816,139.792,PM98vt,JP-YT,15,12,401,0,0
JA-1086,Kenmin Ryokuchi Prefectural Park,38.2395,140.362,QM08ef,JP-YT,24,23,663,0,2
JA-1087,Kenseishi Ryokuchi Prefectural Park,38.2565,140.341,QM08eg,JP-YT,11,11,293,0,0
JA-1088,Ryozen Prefectural Nature Park,37.7765,140.677,QM07is,JP-FS,7,7,278,0,0
JA-1089,Kasumigajo Prefectural Nature Park,37.5991,140.429,QM07fo,JP-FS,11,10,283,0,0
JA-1090,Nanko Prefectural Nature Park,37.1097,140.22,QM07cc,JP-FS,16,16,491,0,1
JA-1091,Okukuji Prefectural Nature Park,36.9379,140.28,QM06dw,JP-FS,10,10,304,0,1
JA-1092,Iwaki Kaigan Prefectural Nature Park,37.1364,140.998,QM07ld,JP-FS,13,13,496,0,0
JA-1093,Matsukawaura Prefectural Nature Park,37.7981,140.976,QM07lt,JP-FS,9,9,273,0,0
JA-1094,Nakoso Prefectural Nature Park,36.8678,140.782,QM06ju,JP-FS,8,8,165,0,0
JA-1096,Okawa Hatori Prefectural Nature Park,37.2615,140.07,QM07ag,JP-FS,84,81,1792,0,0
JA-1097,Abukuma Kogen Chubu Prefectural Nature Park,37.3549,140.698,QM07ii,JP-FS,11,10,277,0,1
JA-1098,Natsuigawa Keikoku Prefectural Nature Park,37.1016,140.798,QM07jc,JP-FS,9,7,205,0,0
JA-1099,Azuma Sports Prefectural Park,37.7201,140.36,QM07er,JP-FS,11,11,343,0,0
JA-1100,Ouse Prefectural Park,37.4128,140.274,QM07dj,JP-FS,11,11,296,0,0
JA-1101,Fukushima Airport Prefectural Park,37.2467,140.42,QM07ff,JP-FS,9,9,205,0,0
JA-1102,Azumagaoka Prefectural Park,37.6313,140.969,QM07lp,JP-FS,7,7,156,0,0
JA-1103,Iwaki Prefectural Park,37.0108,140.92,QM07la,JP-FS,4,4,81,0,0
JA-1104,Hirono Bosai Ryokuchi Prefectural Park,37.2087,141.004,QM07mf,JP-FS,4,4,100,0,0
JA-1105,Aizu Recreation Prefectural Park,37.515,140.018,QM07am,JP-FS,19,19,505,0,1
JA-1106,Hanazono Hananuki Prefectural Nature Park,36.8348,140.703,QM06iu,JP-IB,7,7,144,0,0
JA-1107,Takasuzu Prefectural Nature Park,36.6143,140.589,QM06ho,JP-IB,15,13,439,0,1
JA-1108,Ota Prefectural Nature Park,36.5418,140.514,QM06gn,JP-IB,8,8,288,0,0
JA-1109,Okukuji Prefectural Nature Park,36.9269,140.263,QM06dw,JP-IB,18,16,422,0,0
JA-1110,Oarai Prefectural Prefectural Nature Park,36.3591,140.614,QM06hi,JP-IB,24,20,593,0,1
JA-1111,Mito Prefectural Nature Park,36.3724,140.46,QM06fi,JP-IB,21,20,469,0,0
JA-1112,Gozenyama Prefectural Nature Park,36.5448,140.324,QM06dn,JP-IB,12,11,346,0,0
JA-1113,Wagakuni Atago Prefectural Nature Park,36.3047,140.225,QM06ch,JP-IB,29,25,854,0,0
JA-1114,Kasama Prefectural Nature Park,36.3837,140.268,QM06dj,JP-IB,15,15,736,0,1
JA-1115,Kairakuen Prefectural Park,36.3725,140.452,QM06fi,JP-IB,11,11,262,0,0
JA-1116,Kodokan Prefectural Park,36.3761,140.478,QM06fj,JP-IB,9,8,129,0,0
JA-1117,Oarai Prefectural Park,36.3257,140.593,QM06hh,JP-IB,15,14,455,0,1
JA-1118,Kasama Geijutsu no mori Prefectural Park,36.3715,140.266,QM06di,JP-IB,10,10,197,0,0
JA-1119,Minato Prefectural Park,35.9134,140.672,QM05iv,JP-IB,14,14,333,0,0
JA-1120,Kashimanada Sea Side Prefectural Park,36.1505,140.577,QM06gd,JP-IB,13,11,376,0,1
JA-1121,Daigo Koiki Prefectural Park,36.7915,140.35,QM06es,JP-IB,9,9,305,0,0
JA-1122,Doho Prefectural Park,36.0619,140.123,QM06bb,JP-IB,21,19,314,0,0
JA-1123,Sanuma Koiki Prefectural Park,36.1891,139.948,PM96xe,JP-IB,18,16,343,0,0
JA-1124,Kensei Sogo Prefectural Park,36.3052,140.017,QM06ah,JP-IB,15,13,277,0,0
JA-1125,Kasamatsu Sports Prefectural Park,36.455,140.539,QM06gk,JP-IB,18,16,367,0,0
JA-1126,Horihara Sports Prefectural Park,36.3984,140.44,QM06fj,JP-IB,9,9,155,0,0
JA-1128,Mae Nikko Prefectural Nature Park,36.623,139.521,PM96so,JP-TC,44,37,1958,0,0
JA-1129,Yamizo Prefectural Nature Park,36.7838,140.144,QM06bs,JP-TC,30,26,732,0,0
JA-1130,Nakagawa Prefectural Nature Park,36.5978,140.188,QM06co,JP-TC,17,16,682,0,1
JA-1131,Mashiko Prefectural Nature Park,36.4661,140.119,QM06bl,JP-TC,16,16,649,0,1
JA-1132,Ohirasan Prefectural Nature Park,36.3599,139.698,PM96ui,JP-TC,157,105,2115,0,1
JA-1133,Karasawayama Prefectural Nature Park,36.3538,139.6,PM96ti,JP-TC,51,40,1337,0,1
JA-1134,Ashikaga Prefectural Nature Park,36.3798,139.442,PM96rj,JP-TC,48,42,2448,0,7
JA-1135,Utsunomiya Prefectural Nature Park,36.6059,139.81,PM96vo,JP-TC,40,38,2516,0,0
JA-1136,Tochigi Sports Prefectural Park,36.5109,139.859,PM96wm,JP-TC,15,14,296,0,1
JA-1137,Igashira Prefectural Park,36.4944,139.997,PM96xl,JP-TC,9,9,236,0,0
JA-1138,Kinu Green Prefectural Park,36.6302,139.957,PM96xp,JP-TC,11,11,282,0,1
JA-1139,Tochigi Central Prefectural Park,36.5583,139.863,PM96wn,JP-TC,15,15,309,0,0
JA-1140,Nasunogahara Prefectural Park,36.9323,139.949,PM96xw,JP-TC,12,11,278,0,1
JA-1141,Mikamoyama Prefectural Park,36.3053,139.627,PM96th,JP-TC,27,22,543,0,1
JA-1142,Nikko Tamozawa Implerial Villa Memorial Prefectural Park,36.7524,139.591,PM96ts,JP-TC,10,10,179,0,0
JA-1143,Nikko Daiyagawa Prefectural Park,36.7353,139.663,PM96tr,JP-TC,12,12,248,0,1
JA-1144,Tochigi Wanpaku Prefectural Park,36.4587,139.808,PM96vl,JP-TC,19,16,508,0,0
JA-1145,Sayama Prefectural Nature Park,35.7777,139.416,PM95qs,JP-ST,102,87,3101,0,28
JA-1146,Okumusashi Prefectural Nature Park,35.9061,139.19,PM95ov,JP-ST,229,190,7858,0,45
JA-1147,Kuroyama Prefectural Nature Park,35.9592,139.236,PM95ox,JP-ST,269,237,20555,0,43
JA-1148,Nagatoro Tamayodo Prefectural Nature Park,36.0949,139.115,PM96nc,JP-ST,269,236,13679,0,10
JA-1149,Hikikyuryo Prefectural Nature Park,36.0004,139.364,PM96qa,JP-ST,81,75,3471,0,8
JA-1150,Jobu Prefectural Nature Park,36.1292,139.023,PM96md,JP-ST,34,31,1316,0,0
JA-1151,Buko Prefectural Nature Park,35.9539,139.013,PM95mw,JP-ST,110,92,3454,0,5
JA-1152,Angyo Bunan Prefectural Nature Park,35.8541,139.735,PM95uu,JP-ST,66,64,1634,0,11
JA-1153,Ryogami Prefectural Nature Park,36,138.927,PM96la,JP-ST,18,18,587,0,1
JA-1154,Nishichichibu Prefectural Nature Park,36.0615,138.963,PM96lb,JP-ST,33,31,1453,0,2
JA-1155,Kitaurawa Prefectural Park,35.8699,139.644,PM95tu,JP-ST,46,36,766,0,1
JA-1156,Saitama Stadium 2002 Prefectural Park,35.903,139.715,PM95uv,JP-ST,21,21,381,0,0
JA-1157,Akigase Prefectural Park,35.8499,139.602,PM95tu,JP-ST,91,84,3471,0,28
JA-1158,Omiya Prefectural Park,35.9187,139.631,PM95tw,JP-ST,44,39,1061,0,5
JA-1159,Shirakobato Suijo Prefectural Park,35.9134,139.749,PM95uv,JP-ST,15,15,428,0,0
JA-1160,Ageo Undo Prefectural Park,35.9684,139.602,PM95tx,JP-ST,17,17,388,0,0
JA-1162,Kumagaya Sports & Culture Prefectural Park,36.1665,139.405,PM96qd,JP-ST,16,16,500,0,3
JA-1163,Yoshimi Athletic Prefectural Park,36.0575,139.472,PM96rb,JP-ST,37,36,1426,0,3
JA-1164,Saitama Prefectural Forest Prefectural Park,35.9895,139.157,PM95nx,JP-ST,55,47,1758,0,3
JA-1165,Wako Jurin Prefectural Park,35.7773,139.599,PM95ts,JP-ST,37,34,869,0,28
JA-1166,Sainomori Iruma Prefectural Park,35.8376,139.399,PM95qu,JP-ST,33,30,914,0,2
JA-1167,Kazo Hanasaki Prefectural Park,36.1012,139.633,PM96tc,JP-ST,18,17,363,0,0
JA-1168,Matsubushi Midorinooka Prefectural Park,35.9458,139.81,PM95vw,JP-ST,24,24,586,0,1
JA-1169,Hanyu Suigo Prefectural Park,36.1716,139.595,PM96te,JP-ST,17,17,400,0,0
JA-1170,Gongendo Prefectural Park,36.1076,139.725,PM96uc,JP-ST,19,17,374,0,0
JA-1171,Kukisyobu Prefectural Park,36.0543,139.646,PM96tb,JP-ST,19,17,373,0,1
JA-1172,Yoshikawa Prefectural Park,35.911,139.873,PM95wv,JP-ST,17,15,302,0,0
JA-1173,Misato Prefectural Park,35.7846,139.873,PM95ws,JP-ST,27,25,719,0,1
JA-1174,Kawagoe Prefectural Park,35.9134,139.451,PM95rv,JP-ST,128,128,2624,0,4
JA-1175,Kodomo Dobutsu Prefectural Park,35.997,139.374,PM95qx,JP-ST,16,16,570,0,1
JA-1176,Kitamoto Shizen Kansatsu Prefectural Park,36.0108,139.509,PM96sa,JP-ST,21,19,656,0,2
JA-1177,Arakawa Oaso Prefectural Park,36.1434,139.349,PM96qd,JP-ST,22,20,736,0,0
JA-1178,Sakitama Kofun Prefectural Park,36.1277,139.475,PM96rd,JP-ST,23,20,703,0,2
JA-1179,Toda Prefectural Park,35.8017,139.676,PM95ut,JP-ST,39,37,847,0,6
JA-1180,Tokorozawa Aviation Memorial Prefectural Park,35.7976,139.474,PM95rt,JP-ST,77,66,1729,0,54
JA-1181,Sayama Inariyama Prefectural Park,35.8475,139.397,PM95qu,JP-ST,34,29,621,0,1
JA-1182,Yoro Keikoku Okukiyosumi Prefectural Nature Park,35.2517,140.163,QM05bg,JP-CH,13,12,353,0,0
JA-1183,Kujukuri Prefectural Nature Park,35.4473,140.404,QM05ek,JP-CH,54,50,2011,0,5
JA-1184,Inba Tega Prefectural Nature Park,35.7566,140.189,QM05cs,JP-CH,64,54,1857,0,8
JA-1185,Takagoyama Prefectural Nature Park,35.198,139.993,PM95xe,JP-CH,31,30,840,0,0
JA-1186,Mineoka Sankei Prefectural Nature Park,35.106,140.01,QM05ac,JP-CH,17,16,527,0,0
JA-1187,Tomisan Prefectural Nature Park,35.0953,139.882,PM95wc,JP-CH,20,19,440,0,1
JA-1188,Otone Prefectural Nature Park,35.9151,140.468,QM05fv,JP-CH,20,20,710,0,2
JA-1189,Kasamori Tsurumai Prefectural Nature Park,35.3995,140.201,QM05cj,JP-CH,43,37,1364,0,6
JA-1190,Hagoromo Prefectural Park,35.6037,140.123,QM05bo,JP-CH,11,10,163,0,0
JA-1191,Aobanomori Prefectural Park,35.5965,140.141,QM05bo,JP-CH,36,34,809,0,1
JA-1192,Chiba Central Sports Center Prefectural Park,35.6503,140.126,QM05bp,JP-CH,23,22,667,0,0
JA-1193,Makuhari Seaside Prefectural Park,35.6446,140.043,QM05ap,JP-CH,37,35,844,0,3
