reference,name,latitude,longitude,grid,locationDesc,attempts,activations,qsos,my_activations,my_hunted_qsos
JP-1193,Makuhari Seaside Prefectural Park,35.6446,140.043,QM05ap,JP-CH,48,46,1235,0,3
JP-1194,Gyoda Prefectural Park,35.7195,139.973,PM95xr,JP-CH,31,28,672,0,0
JP-1195,Kashiwa no Ha Prefectural Park,35.8957,139.938,PM95xv,JP-CH,60,60,1491,0,1
JP-1196,Teganuma Shizen Fureai Greenway Prefectural Park,35.8572,140.041,QM05au,JP-CH,86,80,2249,0,5
JP-1197,Inbanuma Prefectural Park,35.7526,140.184,QM05cs,JP-CH,36,34,977,0,1
JP-1198,Hokuso Hananooka Prefectural Park,35.789,140.124,QM05bs,JP-CH,20,20,599,0,2
JP-1199,Hasunuma Seaside Prefectural Park,35.5887,140.502,QM05go,JP-CH,17,17,754,0,1
JP-1200,Chosei no mori Prefectural Park,35.4547,140.267,QM05dk,JP-CH,18,17,540,0,1
JP-1201,Tateyama Sports Prefectural Park,34.9611,139.853,PM94wx,JP-CH,16,16,491,0,3
JP-1202,Futtsu Prefectural Park,35.3111,139.803,PM95vh,JP-CH,57,52,1587,0,2
JP-1203,Yachiyo Prefectural Park,35.7304,140.112,QM05br,JP-CH,25,22,746,0,4
JP-1204,Takiyama Nature Prefectural Nature Park,35.7009,139.332,PM95pq,JP-TK,86,82,3369,0,13
JP-1205,Takao Jinba Prefectural Nature Park,35.6506,139.221,PM95op,JP-TK,115,94,4684,0,11
JP-1206,Tama Kyuryo Prefectural Nature Park,35.6601,139.41,PM95qp,JP-TK,529,441,18034,0,160
JP-1207,Sayama Nature Prefectural Nature Park,35.7607,139.438,PM95rs,JP-TK,292,271,11604,0,36
JP-1208,Hamura Kusabana Kyuryo Prefectural Nature Park,35.7554,139.309,PM95ps,JP-TK,129,115,6767,0,16
JP-1209,Akigawa Kyuryo Prefectural Nature Park,35.7138,139.273,PM95pr,JP-TK,116,103,5398,0,7
JP-1210,Kyu-Iwasaki-tei Gardens Prefectural Park,35.7095,139.768,PM95vr,JP-TK,43,37,526,0,3
JP-1211,Kyu Shiba Rikyu Garden Prefectural Park,35.6547,139.758,PM95vp,JP-TK,54,50,868,0,6
JP-1212,Kyu-Furukawa Gardens Prefectural Park,35.7422,139.746,PM95ur,JP-TK,19,18,289,0,3
JP-1213,Kiyosumi Gardens Prefectural Park,35.6807,139.797,PM95vq,JP-TK,83,78,1659,0,2
JP-1214,Koishikawa-Korakuen Gardens Prefectural Park,35.7054,139.749,PM95uq,JP-TK,51,45,779,0,3
JP-1215,Tonogayato Gardens Prefectural Park,35.6986,139.482,PM95rq,JP-TK,37,35,492,0,3
JP-1216,Hama-rikyu Gardens Prefectural Park,35.6596,139.763,PM95vp,JP-TK,41,39,835,0,2
JP-1217,Mukojima-Hyakkaen Gardens Prefectural Park,35.7241,139.815,PM95vr,JP-TK,31,31,475,0,1
JP-1218,Rikugi-en Gardens Prefectural Park,35.7332,139.746,PM95ur,JP-TK,23,22,344,0,2
JP-1219,Aoyama Prefectural Park,35.6633,139.724,PM95up,JP-TK,111,106,1892,0,0
JP-1220,Akatsuka Prefectural Park,35.7848,139.657,PM95ts,JP-TK,54,51,969,0,2
JP-1221,Ueno Prefectural Park,35.7155,139.774,PM95vr,JP-TK,438,380,7730,0,4
JP-1222,Ukita Prefectural Park,35.6744,139.861,PM95wq,JP-TK,35,28,558,0,0
JP-1223,Ukima Prefectural Park,35.7938,139.693,PM95ut,JP-TK,34,29,590,0,1
JP-1224,Oizumi-Chuo Prefectural Park,35.775,139.599,PM95ts,JP-TK,36,32,791,0,21
JP-1225,Ojima Komatsugawa Prefectural Park,35.6928,139.85,PM95wq,JP-TK,87,56,1222,0,2
JP-1226,Ogunohara Prefectural Park,35.7512,139.776,PM95vs,JP-TK,52,48,830,0,3
JP-1227,Kasai Rinkai Prefectural Park,35.6407,139.86,PM95wp,JP-TK,61,55,1186,0,0
JP-1228,Kameido Chuo Prefectural Park,35.7005,139.836,PM95wq,JP-TK,50,40,737,0,1
JP-1229,Kinuta Prefectural Park,35.6303,139.62,PM95tp,JP-TK,93,86,2465,0,15
JP-1230,Kiba Prefectural Park,35.6745,139.809,PM95vq,JP-TK,90,74,1393,0,0
JP-1231,Komazawa Olympic Prefectural Park,35.6257,139.662,PM95tp,JP-TK,74,60,1603,0,3
JP-1232,Sarue Prefectural Park,35.6901,139.818,PM95vq,JP-TK,43,41,776,0,2
JP-1233,Shioiri Prefectural Park,35.7363,139.81,PM95vr,JP-TK,95,81,1535,0,0
JP-1234,Shiokaze Prefectural Park,35.6238,139.769,PM95vo,JP-TK,58,56,1233,0,2
JP-1235,Shinozaki Prefectural Park,35.7156,139.898,PM95wr,JP-TK,39,34,742,0,0
JP-1236,Shiba Prefectural Park,35.6549,139.748,PM95up,JP-TK,74,65,1220,0,2
JP-1237,Shakujii Prefectural Park,35.7383,139.599,PM95tr,JP-TK,49,40,865,1,14
JP-1238,Johoku-Chuo Prefectural Park,35.7566,139.673,PM95us,JP-TK,102,89,2486,0,8
JP-1239,Zenpukujigawa Prefectural Park,35.6906,139.632,PM95tq,JP-TK,53,38,693,0,3
JP-1240,Zenpukuji Prefectural Park,35.7146,139.591,PM95tr,JP-TK,28,24,385,0,3
JP-1241,Soshigaya Prefectural Park,35.6546,139.599,PM95tp,JP-TK,27,25,538,0,1
JP-1242,Daiba Prefectural Park,35.6336,139.772,PM95vp,JP-TK,32,31,618,0,0
JP-1243,The Tokyo Rinkai Disaster Prevention Prefectural Park,35.6346,139.797,PM95vp,JP-TK,53,52,759,0,3
JP-1244,Toneri Prefectural Park,35.797,139.772,PM95vt,JP-TK,199,190,6992,0,22
JP-1245,Toyama Prefectural Park,35.7055,139.704,PM95uq,JP-TK,170,136,3327,0,3
JP-1246,Nakagawa Prefectural Park,35.7753,139.846,PM95ws,JP-TK,40,39,685,0,2
JP-1247,Higashi Ayase Prefectural Park,35.771,139.831,PM95vs,JP-TK,65,63,1126,0,1
JP-1248,Higashi Shirahige Prefectural Park,35.7336,139.814,PM95vr,JP-TK,46,42,767,0,2
JP-1249,Hikarigaoka Prefectural Park,35.7666,139.629,PM95ts,JP-TK,121,114,2584,0,40
JP-1250,Hibiya Prefectural Park,35.6731,139.756,PM95vq,JP-TK,256,222,5938,0,27
JP-1251,Mizumoto Prefectural Park,35.7869,139.87,PM95ws,JP-TK,48,45,1055,0,2
JP-1252,Meiji Prefectural Park,35.6791,139.712,PM95uq,JP-TK,71,63,964,0,0
JP-1253,Yumenoshima Prefectural Park,35.6511,139.827,PM95vp,JP-TK,84,74,1564,0,2
JP-1254,Yokoamicho Prefectural Park,35.6992,139.796,PM95vq,JP-TK,76,72,1278,0,2
JP-1255,Yoyogi Prefectural Park,35.6716,139.696,PM95uq,JP-TK,170,126,2646,0,3
JP-1256,Rinshinomori Prefectural Park,35.6249,139.703,PM95uo,JP-TK,125,116,2940,0,6
JP-1257,Roka Koshunen Prefectural Park,35.6617,139.613,PM95tp,JP-TK,41,39,765,0,2
JP-1258,Wadabori Prefectural Park,35.6845,139.641,PM95tq,JP-TK,103,93,1871,0,4
JP-1259,Akirudai Prefectural Park,35.7303,139.3,PM95pr,JP-TK,47,44,1185,0,4
JP-1260,Inokashira Prefectural Park,35.7,139.576,PM95sq,JP-TK,37,31,655,0,3
JP-1261,Oto Prefectural Park,35.6152,139.285,PM95po,JP-TK,79,74,1362,0,2
JP-1262,Oyamadairi Prefectural Park,35.6062,139.368,PM95qo,JP-TK,70,65,1559,0,8
JP-1263,Oyamada Prefectural Park,35.5976,139.417,PM95ro,JP-TK,82,72,2480,0,3
JP-1264,Koganei Prefectural Park,35.7164,139.518,PM95sr,JP-TK,196,148,2718,0,36
JP-1265,Komiya Prefectural Park,35.6731,139.34,PM95qq,JP-TK,44,41,948,0,8
JP-1266,Sakuragaoka Prefectural Park,35.639,139.461,PM95rp,JP-TK,121,113,4712,0,71
JP-1267,Sayama Prefectural Park,35.7618,139.442,PM95rs,JP-TK,120,108,3559,0,22
JP-1268,Sayama Sakai Ryokudo Prefectural Park,35.7555,139.444,PM95rs,JP-TK,59,45,876,0,21
JP-1269,Sengenyama Prefectural Park,35.68,139.5,PM95sq,JP-TK,59,53,969,0,13
JP-1270,Takiyama Prefectural Park,35.7016,139.328,PM95pq,JP-TK,58,55,1414,0,9
JP-1271,Tamagawa Jyosui Ryokudo Prefectural Park,35.7218,139.358,PM95qr,JP-TK,73,66,1954,0,7
JP-1272,Naganuma Prefectural Park,35.6382,139.368,PM95qp,JP-TK,71,66,2167,0,17
JP-1273,Nogawa Prefectural Park,35.6832,139.525,PM95sq,JP-TK,43,39,716,0,1
JP-1274,Noyamakita Rokudoyama Prefectural Park,35.7643,139.378,PM95qs,JP-TK,175,152,7354,0,14
JP-1275,Hachikokuyama Ryokuchi Prefectural Park,35.7698,139.459,PM95rs,JP-TK,64,47,1295,0,38
JP-1276,Higashifushimi Prefectural Park,35.7287,139.557,PM95sr,JP-TK,274,214,4340,0,266
JP-1277,Higashimurayama Chuo Prefectural Park,35.7476,139.459,PM95rr,JP-TK,50,43,1170,0,19
JP-1278,Higashiyamato Prefectural Park,35.7554,139.432,PM95rs,JP-TK,35,33,747,0,6
JP-1279,Higashiyamato Minami Prefectural Park,35.7345,139.422,PM95rr,JP-TK,30,27,543,0,8
JP-1280,Hirayama Joshi Prefectural Park,35.6397,139.383,PM95qp,JP-TK,264,205,8280,0,59
JP-1281,Fuchunomori Prefectural Park,35.6765,139.492,PM95rq,JP-TK,45,33,620,0,2
JP-1282,Musashi Kokubunji Prefectural Park,35.697,139.472,PM95rq,JP-TK,427,394,6402,0,126
JP-1283,Musashino Prefectural Park,35.6894,139.519,PM95sq,JP-TK,41,36,630,0,6
JP-1284,Musashino Chuo Prefectural Park,35.7181,139.556,PM95sr,JP-TK,200,162,3476,0,256
JP-1285,Musashinonomori Prefectural Park,35.6765,139.523,PM95sq,JP-TK,53,49,857,0,4
JP-1286,Ryonan Prefectural Park,35.6488,139.288,PM95pp,JP-TK,32,30,571,0,2
JP-1287,Rokusen Prefectural Park,35.7503,139.523,PM95ss,JP-TK,369,326,7996,2,838
JP-1288,Ogamiyama Prefectural Park,27.0939,142.192,QL17cc,JP-OG,0,0,0,0,1
JP-1289,Tanzawa Oyama Prefectural Nature Park,35.512,139.26,PM95pm,JP-KN,101,84,3251,0,7
JP-1290,Jinba Sagamiko Prefectural Nature Park,35.6581,139.154,PM95np,JP-KN,87,77,2123,0,2
JP-1291,Oku Yugawara Prefectural Nature Park,35.1523,139.095,PM95nd,JP-KN,24,24,626,0,1
JP-1292,Manazuru Hanto Prefectural Nature Park,35.1461,139.148,PM95nd,JP-KN,32,27,793,0,1
JP-1293,Odawara Suwanohara Prefectural Park,35.2825,139.134,PM95ng,JP-KN,25,23,575,0,1
JP-1294,Hayama Sangaokayama Prefectural Park,35.2682,139.578,PM95sg,JP-KN,39,33,788,0,3
JP-1295,Hayama Prefectural Park,35.2583,139.58,PM95sg,JP-KN,70,67,1988,0,1
JP-1296,Onshi Hakone Prefectural Park,35.1956,139.026,PM95me,JP-KN,22,21,498,0,1
JP-1297,Oiso Joyama Prefectural Park,35.3049,139.29,PM95ph,JP-KN,30,28,647,0,1
JP-1298,Jogashima Prefectural Park,35.1316,139.625,PM95td,JP-KN,45,37,1192,0,3
JP-1299,Zama Yatoyama Prefectural Park,35.4867,139.404,PM95ql,JP-KN,82,72,1980,0,6
JP-1300,Sagami Sansen Prefectural Park,35.4592,139.381,PM95ql,JP-KN,63,57,1667,0,6
JP-1301,Nanasawa Shinrin Prefectural Park,35.4472,139.301,PM95pk,JP-KN,43,37,806,0,2
JP-1302,Shonan Shiomidai Prefectural Park,35.3218,139.438,PM95rh,JP-KN,24,23,404,0,0
JP-1303,Tsukayama Prefectural Park,35.28,139.641,PM95tg,JP-KN,62,36,837,0,1
JP-1304,Hodogaya Prefectural Park,35.4545,139.585,PM95tk,JP-KN,316,262,7786,0,1
JP-1305,Sagamiko Prefectural Park,35.6125,139.191,PM95oo,JP-KN,26,26,484,0,2
JP-1306,Higashitakane Shinrin Prefectural Park,35.6043,139.587,PM95to,JP-KN,80,75,2027,0,6
JP-1307,Shikinomori Prefectural Park,35.5025,139.536,PM95sm,JP-KN,200,185,6002,0,2
JP-1308,Aikawa Prefectural Park,35.5422,139.256,PM95pn,JP-KN,38,37,965,0,3
JP-1309,Hadano Tokawa Prefectural Park,35.403,139.173,PM95oj,JP-KN,26,23,627,0,1
JP-1310,Chigasaki Satoyama Prefectural Park,35.3731,139.418,PM95ri,JP-KN,91,84,3062,0,7
JP-1311,Shonan Kaigan Prefectural Park,35.3136,139.474,PM95rh,JP-KN,41,36,906,0,1
JP-1312,Kannonzaki Prefectural Park,35.256,139.739,PM95ug,JP-KN,38,31,739,0,2
JP-1313,Tsukuiko Shiroyama Prefectural Park,35.582,139.282,PM95pn,JP-KN,97,87,2202,0,10
JP-1314,Tsujido Kaihin Prefectural Park,35.3209,139.448,PM95rh,JP-KN,47,42,1043,0,3
JP-1315,Sagamihara Prefectural Park,35.5312,139.387,PM95qm,JP-KN,179,172,5080,0,13
JP-1316,Sakaigawa Yusuichi Prefectural Park,35.3907,139.482,PM95rj,JP-KN,84,78,2678,0,3
JP-1317,Mitsuike Prefectural Park,35.5226,139.661,PM95tm,JP-KN,155,147,5257,0,2
JP-1318,Akagi Prefectural Park,36.5418,139.191,PM96on,JP-GM,47,41,1336,0,1
JP-1319,Haruna Prefectural Park,36.4712,138.873,PM96kl,JP-GM,20,19,446,0,1
JP-1320,Myogi Prefectural Park,36.2865,138.74,PM96ig,JP-GM,13,12,313,0,2
JP-1321,Shikishima Prefectural Park,36.4142,139.051,PM96mj,JP-GM,15,13,250,0,0
JP-1322,Gunma no Mori Prefectural Park,36.2979,139.081,PM96mh,JP-GM,21,19,458,0,0
JP-1323,Kanayama General Prefectural Park,36.3185,139.372,PM96qh,JP-GM,26,23,667,0,1
JP-1324,Kannonyama Family Prefectural Park,36.2903,138.993,PM96lg,JP-GM,29,26,735,0,0
JP-1325,Tataranuma Prefectural Park,36.2578,139.504,PM96sg,JP-GM,42,36,1101,0,1
JP-1326,Shibireko Prefectural Nature Park,35.5291,138.517,PM95gm,JP-YN,24,22,842,0,2
JP-1327,Minami Alps Koma Prefectural Nature Park,35.5941,138.357,PM95eo,JP-YN,49,44,1335,0,2
JP-1328,Kose Sports Prefectural Park,35.6222,138.587,PM95ho,JP-YN,28,25,666,0,1
JP-1329,Atagoyama Koiki Prefectural Park,35.6724,138.582,PM95gq,JP-YN,15,15,285,0,0
JP-1330,Sone Kyuryo Prefectural Park,35.5898,138.582,PM95go,JP-YN,24,22,621,0,0
JP-1331,Midai Minami Prefectural Park,35.6681,138.455,PM95fq,JP-YN,22,22,642,0,1
JP-1332,Flower Center Heidi's Village Prefectural Park,35.7809,138.464,PM95fs,JP-YN,18,17,628,0,0
JP-1333,Fujikawa Craft Prefectural Park,35.4181,138.437,PM95fk,JP-YN,23,18,604,0,2
JP-1334,Fujihokuroku Prefectural Park,35.454,138.768,PM95jk,JP-YN,26,25,920,0,1
JP-1335,Ontake Prefectural Nature Park,35.9127,137.518,PM85sv,JP-NN,22,22,863,0,0
JP-1336,Mibugawa Suikei Prefectural Nature Park,35.8311,138.062,PM95at,JP-NN,33,31,805,0,1
JP-1337,Enrei Ojo Prefectural Nature Park,36.0859,138.029,PM96ac,JP-NN,160,154,3834,0,9
JP-1338,Hijiriyama Kogen Prefectural Nature Park,36.4896,138.065,PM96al,JP-NN,39,37,981,0,0
JP-1339,Tenryu Koshibu Suikei Prefectural Nature Park,35.6121,137.988,PM85xo,JP-NN,15,15,393,0,0
JP-1340,Karasugawa Keikoku Ryokuchi Prefectural Park,36.3135,137.831,PM86vh,JP-NN,18,18,301,0,1
JP-1341,Matsumotodaira Koiki Prefectural Park,36.1682,137.925,PM86xe,JP-NN,76,72,1770,0,4
JP-1342,Minami Shinshu Koiki Prefectural Park,35.2496,137.67,PM85uf,JP-NN,19,19,1578,0,1
JP-1343,Iida Undo Prefectural Park,35.4857,137.8,PM85vl,JP-NN,13,13,337,0,0
JP-1344,Komaba Prefectural Park,36.2551,138.486,PM96fg,JP-NN,19,19,466,0,0
JP-1345,Wakasato Prefectural Park,36.6347,138.188,PM96cp,JP-NN,17,17,387,0,0
JP-1347,Nagano Sports Prefectural Park,36.6591,138.232,PM96cp,JP-NN,17,16,304,0,3
JP-1348,Senami Sasagawanagare Awashima Prefectural Nature Park,38.423,139.476,PM98rk,JP-NI,23,20,2651,0,0
JP-1349,Tainai Ninoji Prefectural Nature Park,37.9695,139.514,PM97sx,JP-NI,12,11,520,0,0
JP-1350,Aganogawa Line Prefectural Nature Park,37.6862,139.457,PM97rq,JP-NI,15,14,505,0,0
JP-1351,Gozu Renpo Prefectural Nature Park,37.8143,139.358,PM97qt,JP-NI,6,6,430,0,0
JP-1352,Nagaoka Higashiyama Yamamotoyama Prefectural Nature Park,37.4228,138.934,PM97lk,JP-NI,7,6,221,0,0
JP-1353,Okuhayade Awa Sumon Prefectural Nature Park,37.5793,139.147,PM97nn,JP-NI,4,4,146,0,0
JP-1354,Uonuma Renpo Prefectural Nature Park,37.0143,138.965,PM97la,JP-NI,7,6,222,0,0
JP-1355,Yoneyama Fukuurahakkei Prefectural Nature Park,37.3427,138.483,PM97fi,JP-NI,13,12,325,0,0
JP-1356,Naomine Matsunoyama Oike Prefectural Nature Park,37.1745,138.373,PM97ee,JP-NI,14,14,363,0,0
JP-1357,Kubiki Prefectural Nature Park,37.1716,138.096,PM97be,JP-NI,20,20,702,0,0
JP-1358,Hakuba Sanroku Prefectural Nature Park,36.9559,137.961,PM86xw,JP-NI,5,5,175,0,0
JP-1359,Oyashirazu Koshirazu Prefectural Nature Park,36.9921,137.694,PM86ux,JP-NI,8,8,239,0,0
JP-1360,Kosado Prefectural Nature Park,38.066,138.55,PM98gb,JP-NI,9,5,229,0,0
JP-1362,Toyanogata Prefectural Park,37.8802,139.042,PM97mv,JP-NI,9,6,128,0,0
JP-1363,Shimami Ryokuchi Prefectural Park,37.9703,139.206,PM97ox,JP-NI,10,10,226,0,0
JP-1364,Shiunji Kinen Prefectural Park,38.0359,139.297,PM98pa,JP-NI,13,11,352,0,0
JP-1365,Seiro Ryokuchi Prefectural Park,37.9958,139.258,PM97px,JP-NI,11,8,231,0,1
JP-1366,Niigata Prefectural Botanical Garden Prefectural Park,37.7607,139.113,PM97ns,JP-NI,6,6,197,0,2
JP-1367,Okutadami Recreation City Prefectural Park,37.1646,138.936,PM97ld,JP-NI,5,5,182,0,0
JP-1368,Ogata Mizu to Mori Prefectural Park,37.2309,138.35,PM97ef,JP-NI,10,10,197,0,0
JP-1369,Asahi Prefectural Nature Park,36.8561,137.675,PM86uu,JP-TY,10,10,322,0,0
JP-1370,Arimine Prefectural Nature Park,36.4909,137.456,PM86rl,JP-TY,5,5,187,0,0
JP-1371,Gokayama Prefectural Nature Park,36.4133,136.88,PM86kj,JP-TY,7,7,230,0,0
JP-1372,Shiraki Mizunashi Prefectural Nature Park,36.4333,137.082,PM86mk,JP-TY,7,7,165,0,0
JP-1373,Iozen Prefectural Nature Park,36.5364,136.814,PM86jm,JP-TY,27,26,751,0,2
JP-1374,Sogatake Prefectural Nature Park,36.7617,137.564,PM86ss,JP-TY,5,5,125,0,0
JP-1375,Toyama Athletic Recreation Prefectural Park,36.6264,137.197,PM86op,JP-TY,7,7,198,0,1
JP-1376,Gofuku Prefectural Park,36.6967,137.19,PM86oq,JP-TY,8,8,165,0,0
JP-1377,Iwase Sports Prefectural Park,36.743,137.239,PM86or,JP-TY,8,8,149,0,0
JP-1378,Joganjigawa Prefectural Park,36.6943,137.282,PM86pq,JP-TY,10,10,192,0,1
JP-1379,Kuko Sports Ryokuchi Prefectural Park,36.6467,137.19,PM86op,JP-TY,7,7,156,0,0
JP-1380,Fuganunga Kansui Prefectural Park,36.7094,137.212,PM86or,JP-TY,7,7,113,0,0
JP-1381,Shinko no Mori Prefectural Park,36.7689,137.09,PM86ns,JP-TY,6,6,131,0,0
JP-1382,Taikoyama Land Prefectural Park,36.6915,137.105,PM86nq,JP-TY,7,7,127,0,1
JP-1383,Yamanaka Dainichisan Prefectural Nature Park,36.2002,136.419,PM86fe,JP-IS,9,9,237,0,0
JP-1384,Shishiku Tedori Prefectural Nature Park,36.4459,136.648,PM86hk,JP-IS,16,16,312,0,0
JP-1385,Goishigamine Prefectural Nature Park,36.9205,136.891,PM86kw,JP-IS,11,11,312,0,1
JP-1386,Hakusan Ichirino Prefectural Nature Park,36.2287,136.766,PM86jf,JP-IS,7,7,153,0,0
JP-1387,Iozen Prefectural Nature Park,36.5372,136.8,PM86jm,JP-IS,53,50,2008,0,1
JP-1388,Kenmin Kaihin Prefectural Park,36.5926,136.583,PM86go,JP-IS,13,13,345,0,1
JP-1389,Kibagata Prefectural Park,36.3671,136.45,PM86fi,JP-IS,15,15,359,0,1
JP-1390,Hakusanroku Theme Prefectural Park,36.3812,136.613,PM86hj,JP-IS,15,12,255,0,0
JP-1391,Noto Rekishi Prefectural Park,36.9592,136.971,PM86lx,JP-IS,10,10,240,0,1
JP-1392,Hokubu Prefectural Park,36.6273,136.693,PM86ip,JP-IS,18,17,465,0,1
JP-1393,Kanazawajo Prefectural Park,36.5663,136.66,PM86hn,JP-IS,4,4,86,0,0
JP-1394,Okuutatsuyama Kenmin Prefectural Park,36.5602,136.697,PM86in,JP-IS,24,24,510,0,1
JP-1395,Awazu Prefectural Park,36.3549,136.42,PM86fi,JP-IS,9,9,225,0,1
JP-1396,Matto Seaside Prefectural Park,36.5396,136.533,PM86gm,JP-IS,16,15,423,0,0
JP-1397,Seibu Ryokuchi Prefectural Park,36.5751,136.603,PM86hn,JP-IS,24,24,693,0,4
JP-1398,Tedori Prefectural Park,36.4847,136.479,PM86fl,JP-IS,16,15,458,0,1
JP-1399,Honda no Mori Prefectural Park,36.5592,136.662,PM86hn,JP-IS,5,5,70,0,0
JP-1400,Kenrokuen Prefectural Park,36.5619,136.662,PM86hn,JP-IS,4,2,33,0,0
JP-1401,Ishikawa Shikou Kinen Prefectural Park,36.5629,136.655,PM86hn,JP-IS,3,3,44,0,0
JP-1402,Kuratsuki Central Prefectural Park,36.5922,136.625,PM86ho,JP-IS,4,4,97,0,0
JP-1403,Saigawa Ryokuchi Prefectural Park,36.5429,136.671,PM86in,JP-IS,15,14,296,0,0
JP-1404,Onominato Ryokuchi Prefectural Park,36.5957,136.598,PM86ho,JP-IS,15,15,352,0,0
JP-1405,Okuetsu Kogen Prefectural Nature Park,36.0035,136.596,PM86ha,JP-FI,13,13,338,0,0
JP-1406,Wakasa no Sato Prefectural Park,35.484,135.786,PM75vl,JP-FI,3,3,51,0,0
JP-1407,Fukui Shonen Undo Prefectural Park,36.052,136.187,PM86cb,JP-FI,7,5,152,0,2
JP-1408,Rinkai Chuo Prefectural Park,36.1678,136.112,PM86be,JP-FI,6,4,103,0,0
JP-1409,Echizen Togei Prefectural Park,35.935,136.06,PM85aw,JP-FI,5,5,122,0,1
JP-1410,Fukui Toshi Ryokka Shokubutsuen Prefectural Park,36.1061,136.305,PM86dc,JP-FI,9,8,266,0,1
JP-1411,Wakasa Sogo Prefectural Park,35.5159,135.756,PM75vm,JP-FI,4,4,50,0,0
JP-1412,Okuetsu Fureai Prefectural Park,35.9653,136.497,PM85fx,JP-FI,4,4,248,0,0
JP-1413,Trim Park Kanazu Prefectural Park,36.2175,136.25,PM86df,JP-FI,7,7,195,0,0
JP-1414,Tannan Sogo Prefectural Park,35.9288,136.154,PM85bw,JP-FI,6,5,133,0,0
JP-1415,Fukui Sogo Prefectural Park,36.1896,136.133,PM86be,JP-FI,6,6,111,0,0
JP-1416,Sanrihama Kansho Ryokuchi Prefectural Park,36.1857,136.134,PM86be,JP-FI,7,7,185,0,0
JP-1417,Fukui Joshi Prefectural Park,36.0655,136.221,PM86cb,JP-FI,2,2,33,0,0
JP-1418,Senbon Matsubara Prefectural Nature Park,35.1461,136.669,PM85id,JP-GF,60,54,1529,0,6
JP-1419,Ibi Prefectural Nature Park,35.6382,136.487,PM85fp,JP-GF,29,26,1304,0,0
JP-1420,Okuhida Sugo Nagareha Prefectural Nature Park,36.3082,137.246,PM86oh,JP-GF,17,12,396,0,1
JP-1421,Utsue Shijuhattaki Prefectural Nature Park,36.1971,137.161,PM86ne,JP-GF,11,11,307,0,0
JP-1422,Enakyo Prefectural Nature Park,35.4813,137.407,PM85ql,JP-GF,25,24,1098,0,1
JP-1423,Enasan Prefectural Nature Park,35.4444,137.591,PM85tk,JP-GF,32,27,1557,0,0
JP-1424,Urakiso Prefectural Nature Park,35.6981,137.442,PM85rq,JP-GF,15,14,637,0,0
JP-1425,Ibuki Prefectural Nature Park,35.4185,136.433,PM85fk,JP-GF,24,22,962,0,0
JP-1426,Toki Mikuniyama Prefectural Nature Park,35.2546,137.191,PM85og,JP-GF,47,45,2365,0,0
JP-1427,Kuraiyama Funayama Prefectural Nature Park,36.0379,137.199,PM86oa,JP-GF,14,13,770,0,0
JP-1428,Okunagaragawa Prefectural Nature Park,35.9595,136.818,PM85jx,JP-GF,36,33,2218,0,0
JP-1429,Nomugi Prefectural Nature Park,36.0525,137.603,PM86tb,JP-GF,7,7,449,0,1
JP-1430,Seseragi Keikoku Prefectural Nature Park,36.0262,137.07,PM86ma,JP-GF,10,9,265,0,0
JP-1431,Amo Prefectural Nature Park,36.2523,136.963,PM86lg,JP-GF,4,4,72,0,0
JP-1432,Ontakesan Prefectural Nature Park,35.9026,137.464,PM85rv,JP-GF,11,10,246,0,0
JP-1433,Yoro Prefectural Park,35.2823,136.549,PM85gg,JP-GF,24,20,808,0,0
JP-1434,Gifuken Hyakunen Prefectural Park,35.4792,136.87,PM85kl,JP-GF,21,18,571,0,0
JP-1435,GIFU WORLD ROSE GARDEN Prefectural Park,35.4199,137.096,PM85nk,JP-GF,15,15,445,0,1
JP-1436,Gifu Memorial Center Prefectural Park,35.4428,136.763,PM85jk,JP-GF,19,18,419,0,0
JP-1437,Kakamigahara Prefectural Park,35.4247,136.934,PM85lk,JP-GF,16,16,449,0,1
JP-1438,Gifu World Fresh Water Aquarium Prefectural Park,35.3711,136.809,PM85ji,JP-GF,34,34,1125,0,0
JP-1439,Gifu Seiryu Satoyama Prefectural Park,35.4746,137.034,PM85ml,JP-GF,16,15,302,0,0
JP-1440,Nihondaira Prefectural Nature Park,34.9749,138.466,PM94fx,JP-SZ,131,122,5222,0,15
JP-1441,Okuoi Prefectural Nature Park,35.1816,138.111,PM95be,JP-SZ,19,19,567,0,2
JP-1442,Omaezaki Enshunada Prefectural Nature Park,34.5956,138.226,PM94co,JP-SZ,38,37,1408,0,3
JP-1443,Hamanako Prefectural Nature Park,34.6951,137.595,PM84tq,JP-SZ,42,38,2129,0,1
JP-1444,Ashitaka Koiki Prefectural Park,35.1567,138.852,PM95kd,JP-SZ,27,23,623,0,1
JP-1445,Mt. Fuji Children's World Prefectural Park,35.2555,138.772,PM95jg,JP-SZ,21,20,530,0,0
JP-1446,Yoshida Prefectural Park,34.7661,138.285,PM94ds,JP-SZ,32,29,949,0,4
JP-1447,Enshunada Seashore Prefectural Park,34.6687,137.748,PM84uq,JP-SZ,23,23,843,0,1
JP-1448,Hamanako Garden Prefectural Park,34.7139,137.602,PM84tr,JP-SZ,16,16,385,0,1
JP-1449,Shizuoka Pre. Forest Prefectural Park,34.8461,137.782,PM84vu,JP-SZ,21,21,915,0,1
JP-1450,Kusanagi Sports Complex Prefectural Park,34.989,138.429,PM94fx,JP-SZ,50,42,924,0,1
JP-1451,Ogasayama Sports Prefectural Park,34.7439,137.969,PM84xr,JP-SZ,30,28,784,0,2
JP-1452,Atsumi Hanto Prefectural Nature Park,34.6071,137.097,PM84no,JP-AI,30,23,676,0,1
JP-1453,Minami Chita Prefectural Nature Park,34.7478,136.9,PM84kr,JP-AI,84,74,2624,0,3
JP-1454,Dando Kogen Prefectural Nature Park,35.1674,137.473,PM85re,JP-AI,25,25,858,0,1
JP-1455,Furikusa Keikoku Prefectural Nature Park,35.0769,137.665,PM85tb,JP-AI,16,16,616,0,1
JP-1456,Hongusan Prefectural Nature Park,34.9083,137.421,PM84rv,JP-AI,62,57,1474,0,1
JP-1457,Sakurabuchi Prefectural Nature Park,34.8957,137.506,PM84sv,JP-AI,34,34,786,0,0
JP-1458,Ishimakisan Tame Prefectural Nature Park,34.789,137.461,PM84rs,JP-AI,26,24,801,0,1
JP-1459,Atsuta Jingu Prefectural Park,35.1309,136.902,PM85kd,JP-AI,163,149,3797,0,2
JP-1460,Odaka Ryokuchi Prefectural Park,35.0602,136.956,PM85lb,JP-AI,104,98,3095,0,5
JP-1461,Obata Ryokuchi Prefectural Park,35.2196,136.988,PM85lf,JP-AI,255,252,6958,0,0
JP-1463,Shinshiro General Prefectural Park,34.9371,137.542,PM84sw,JP-AI,25,24,549,0,1
JP-1464,Kisogawa Sobue Ryokuchi Prefectural Park,35.2606,136.706,PM85ig,JP-AI,48,46,1317,0,1
JP-1465,Owari Koiki Ryokudo Prefectural Park,35.3341,136.931,PM85li,JP-AI,29,29,962,0,1
JP-1466,Aichi Health Village Prefectural Park,34.9987,136.948,PM84lx,JP-AI,102,95,2375,0,2
JP-1467,Makinogaike Greens Prefectural Park,35.1451,137.014,PM85md,JP-AI,47,46,1568,0,2
JP-1468,Higashi-mikawa Furusato Prefectural Park,34.8387,137.308,PM84pu,JP-AI,153,147,2732,0,1
JP-1469,Expo 2005 Aichi Commemorative Prefectural Park,35.1728,137.09,PM85ne,JP-AI,27,26,653,0,1
JP-1470,Aburagafuchi Waterside Prefectural Park,34.9067,137.008,PM84mv,JP-AI,209,198,4724,0,5
JP-1471,Suigo Prefectural Nature Park,35.1304,136.668,PM85id,JP-ME,102,91,2592,0,4
JP-1472,Ise no Umi Prefectural Nature Park,34.7082,136.523,PM84gq,JP-ME,20,15,432,0,0
JP-1473,Akame Ichishikyo Prefectural Nature Park,34.5608,136.268,PM84dn,JP-ME,13,12,292,0,0
JP-1474,Kahadakyo Prefectural Nature Park,34.3788,136.21,PM84cj,JP-ME,7,7,191,0,0
JP-1475,Okuise Miyagawakyo Prefectural Nature Park,34.2864,136.196,PM84cg,JP-ME,13,12,390,0,0
JP-1476,Hokusei Central Prefectural Park,35.065,136.546,PM85gb,JP-ME,20,20,557,0,2
JP-1477,Suzuka Seishonen no Mori Prefectural Park,34.8533,136.539,PM84gu,JP-ME,18,15,330,0,2
JP-1478,Kameyama Sunshine Prefectural Park,34.8675,136.412,PM84eu,JP-ME,21,18,422,0,2
JP-1479,Daibutsuyama Prefectural Park,34.5169,136.654,PM84hm,JP-ME,10,9,328,0,0
JP-1480,Kumanonada Rinkai Prefectural Park,34.2173,136.347,PM84ef,JP-ME,7,7,347,0,0
JP-1481,Isuzu Prefectural Park,34.4638,136.728,PM84il,JP-ME,5,4,88,0,0
JP-1482,Kencho Mae Prefectural Park,34.7292,136.51,PM84gr,JP-ME,5,5,107,0,0
JP-1483,Mikami Tanakami Shigaraki Prefectural Nature Park,35.0505,136.037,PM85ab,JP-SH,26,24,725,0,1
JP-1484,Kutsuki Katsuragawa Prefectural Nature Park,35.2466,135.867,PM75wf,JP-SH,11,11,267,0,1
JP-1485,Koto Prefectural Nature Park,35.2344,136.3,PM85df,JP-SH,21,21,519,0,0
JP-1486,Obanagawa Prefectural Park,35.0179,135.861,PM75wa,JP-SH,7,7,120,0,0
JP-1487,Biwako Bunka Prefectural Park,34.9698,135.94,PM74xx,JP-SH,15,14,341,0,0
JP-1488,Okubiwa Sports no Mori Prefectural Park,35.4118,136.21,PM85cj,JP-SH,18,18,478,0,1
JP-1489,Kogan Ryokuchi Prefectural Park,35.3864,136.238,PM85cj,JP-SH,17,16,443,0,1
JP-1490,Kasugayama Prefectural Park,35.1227,135.905,PM75wc,JP-SH,10,10,218,0,1
JP-1491,Biwako Chikyu Shimin no Mori Prefectural Park,35.1046,135.963,PM75xc,JP-SH,19,18,576,0,1
JP-1492,Rurikei Prefectural Nature Park,35.0321,135.403,PM75qa,JP-KY,6,6,138,0,0
JP-1493,Hozukyo Prefectural Nature Park,35.0229,135.639,PM75ta,JP-KY,3,3,148,0,0
JP-1494,Kasagiyama Prefectural Nature Park,34.7534,135.942,PM74xs,JP-KY,3,3,79,0,0
JP-1495,Arashiyama Prefectural Park,35.0146,135.671,PM75ua,JP-KY,8,7,104,0,1
JP-1496,Arashiyama Higashi Prefectural Park,35.0099,135.686,PM75ua,JP-KY,5,5,141,0,0
JP-1497,Kamogawa Prefectural Park,35.0406,135.764,PM75va,JP-KY,7,7,166,0,1
JP-1498,Fushimiko Prefectural Park,34.925,135.758,PM74vw,JP-KY,10,9,232,0,0
JP-1499,Rakusai Joka Center Prefectural Park,34.9079,135.708,PM74uv,JP-KY,4,4,136,0,0
JP-1500,Uji Prefectural Park,34.8891,135.809,PM74vv,JP-KY,3,3,127,0,0
JP-1501,Yamashiro Sogo Undo Prefectural Park,34.8726,135.802,PM74vu,JP-KY,9,9,237,0,0
JP-1502,Amanohashidate Prefectural Park,35.5643,135.188,PM75on,JP-KY,12,9,291,0,0
