reference,name,latitude,longitude,grid,locationDesc,attempts,activations,qsos,my_activations,my_hunted_qsos
JP-0001,Rishiri-Rebun-Sarobetsu National Park,45.1942,141.239,QN05oe,JP-HK,13,11,445,0,1
JP-0002,Shiretoko National Park,44.165,145.205,QN24od,JP-HK,4,4,104,0,0
JP-0003,Akan-Mashu National Park,43.4362,144.103,QN23bk,JP-HK,13,11,308,0,0
JP-0004,Kushiroshitsugen National Park,43.1383,144.445,QN23fd,JP-HK,26,19,530,0,1
JP-0005,Daisetsuzan National Park,43.6717,142.907,QN13kq,JP-HK,22,20,528,0,0
JP-0006,Shikotsu-Toya National Park,42.7959,141.221,QN02ot,JP-HK,34,30,800,0,0
JP-0007,Towada-Hachimantai National Park,40.2442,140.939,QN00lf,"JP-AK,JP-AO,JP-IW",48,35,1077,0,1
JP-0008,Sanriku Fukko National Park,39.0046,141.585,QM09ta,"JP-AO,JP-IW,JP-MG",194,182,6699,0,9
JP-0009,Bandai-Asahi National Park,37.8229,139.74,PM97ut,"JP-FS,JP-NI,JP-YT",125,104,3692,0,2
JP-0010,Nikko National Park,36.8763,139.464,PM96rv,"JP-FS,JP-GM,JP-TC",186,164,6885,0,5
JP-0011,Oze National Park,36.9382,139.287,PM96pw,"JP-FS,JP-GM,JP-NI,JP-TC",26,26,776,0,0
JP-0012,Joshinetsu Kogen National Park,36.6919,138.519,PM96gq,"JP-GM,JP-NI,JP-NN",254,223,7535,0,1
JP-0013,Myoko-Togakushi renzan National Park,36.8364,138.077,PM96au,"JP-NI,JP-NN",48,44,1153,0,2
JP-0014,Chichibu-Tama-Kai National Park,35.8593,138.863,PM95ku,"JP-NN,JP-ST,JP-TK,JP-YN",640,566,29507,0,28
JP-0015,Ogasawara National Park,27.0671,142.211,QL17cb,JP-OG,0,0,0,0,3
JP-0016,Fuji-Hakone-Izu National Park,35.2347,139.022,PM95mf,"JP-KN,JP-SZ,JP-TK,JP-YN",1168,887,35201,0,21
JP-0017,Chubusangaku National Park,36.449,137.622,PM86tk,"JP-GF,JP-NI,JP-NN,JP-TY",90,74,1857,0,0
JP-0018,Hakusan National Park,36.1579,136.765,PM86jd,"JP-FI,JP-GF,JP-IS,JP-TY",20,20,497,0,0
JP-0019,Minami Alps National Park,35.6421,138.217,PM95cp,"JP-NN,JP-SZ,JP-YN",18,13,353,0,0
JP-0020,Ise-Shima National Park,34.426,136.802,PM84jk,JP-ME,27,22,724,0,1
JP-0021,Yoshino-Kumano National Park,33.6542,135.659,PM73tp,"JP-ME,JP-NR,JP-WK",54,53,2302,0,1
JP-0022,San'inkaigan National Park,35.6485,134.65,PM75hp,"JP-HG,JP-KY,JP-TT",30,26,1577,0,0
JP-0023,Setonaikai National Park,34.2796,133.229,PM64og,"JP-EH,JP-FO,JP-HG,JP-HS,JP-KG,JP-OS,JP-OT,JP-OY,JP-TS,JP-WK,JP-YC",405,350,13919,0,20
JP-0024,Daisen-Oki National Park,35.4072,133.543,PM65sj,"JP-OY,JP-SM,JP-TT",38,32,1882,0,0
JP-0025,Ashizuri-Uwakai National Park,32.7791,132.979,PM62ls,"JP-EH,JP-KC",34,29,6948,0,0
JP-0026,Saikai National Park,33.1642,129.677,PM43ud,JP-NS,12,10,268,0,0
JP-0027,Unzen-Amakusa National Park,32.7105,130.273,PM52dr,"JP-KM,JP-KS,JP-NS",13,11,253,0,0
JP-0028,Aso-Kuju National Park,32.9499,131.086,PM52nw,"JP-KM,JP-OT",52,45,2264,0,2
JP-0029,Kirishima-Kinkowan National Park,31.9211,130.877,PM51kw,"JP-KS,JP-MZ",31,26,1045,0,2
JP-0030,Yakushima (Island) National Park,30.3261,130.53,PM50gh,JP-KS,1,1,11,0,0
JP-0031,Amamigunto National Park,28.2426,129.309,PL48pf,JP-KS,11,10,527,0,0
JP-0032,Yambaru National Park,26.7286,128.221,PL46cr,JP-ON,8,8,256,0,0
JP-0033,Keramashoto National Park,26.202,127.36,PL36qe,JP-ON,5,4,162,0,0
JP-0034,Iriomote-Ishigaki National Park,24.3515,123.924,PL14xi,JP-ON,58,27,1245,0,1
JP-0101,Shokanbetsu-Teuri-Yagishiri Quasi-National Park,43.7292,141.542,QN03sr,JP-HK,8,7,227,0,0
JP-0102,Abashiri Quasi-National Park,44.1892,143.748,QN14ue,JP-HK,14,13,384,0,0
JP-0103,Niseko-Shakotan-Otaru Kaigan Quasi-National Park,42.8973,140.57,QN02gv,JP-HK,11,11,570,0,0
JP-0104,Hidaka Sanmyaku-Erimo Quasi-National Park,42.4067,142.918,QN12lj,JP-HK,8,8,398,0,0
JP-0105,Onuma Quasi-National Park,41.9858,140.669,QN01ix,JP-HK,4,4,191,0,0
JP-0106,Shimokita Hanto Quasi-National Park,41.3286,141.06,QN01mh,JP-AO,8,8,330,0,0
JP-0107,Tsugaru Quasi-National Park,41.2536,140.345,QN01eg,JP-AO,27,25,1037,0,1
JP-0108,Hayachine Quasi-National Park,39.5432,141.492,QM09rn,JP-IW,6,6,256,0,0
JP-0109,Kurikoma Quasi-National Park,38.9447,140.805,QM08jw,"JP-AK,JP-IW,JP-MG,JP-YT",32,30,1408,0,1
JP-0110,Zao Quasi-National Park,38.1479,140.45,QM08fd,"JP-MG,JP-YT",176,155,5947,0,11
JP-0111,Oga Quasi-National Park,39.8873,139.777,PM99vv,JP-AK,26,21,727,0,0
JP-0112,Chokai Quasi-National Park,39.0781,140.041,QM09ab,"JP-AK,JP-YT",29,24,939,0,1
JP-0113,Echigo sanzan-Tadami Quasi-National Park,37.2688,139.051,PM97mg,"JP-FS,JP-NI",38,35,1204,0,0
JP-0114,Suigo-Tsukuba Quasi-National Park,35.99,140.474,QM05fx,"JP-CH,JP-IB",455,360,31659,0,23
JP-0115,Myogi-Arafune-Saku Kogen Quasi-National Park,36.2934,138.842,PM96kh,"JP-GM,JP-NN",73,66,4105,0,3
JP-0116,Minami-Boso Quasi-National Park,35.1161,140.122,QM05bc,JP-CH,159,150,5702,0,3
JP-0117,Meiji no Mori Takao Quasi-National Park,35.6334,139.266,PM95pp,JP-TK,59,49,1716,0,25
JP-0118,Tanzawa-Oyama Quasi-National Park,35.4105,139.21,PM95oj,JP-KN,131,116,7948,0,3
JP-0119,Sado-Yahiko-Yoneyama Quasi-National Park,38.1614,138.324,PM98dd,JP-NI,17,16,904,0,1
JP-0120,Noto Hanto Quasi-National Park,37.5256,137.257,PM87pm,"JP-IS,JP-TY",50,48,1796,0,1
JP-0121,Echizen-Kaga Kaigan Quasi-National Park,36.249,136.199,PM86cf,"JP-FI,JP-IS",28,27,1058,0,0
JP-0122,Wakasa Wan Quasi-National Park,35.5781,135.875,PM75wn,"JP-FI,JP-KY",49,46,4755,0,0
JP-0123,Yatsugatake-Chushin Kogen Quasi-National Park,35.9981,138.358,PM95ex,"JP-NN,JP-YN",361,319,9562,0,15
JP-0124,Chuo Alps Quasi-National Park,35.7901,137.811,PM85vs,JP-NN,36,32,879,0,1
JP-0125,Tenryu-Okumikawa Quasi-National Park,35.1872,137.757,PM85ve,"JP-AI,JP-NN,JP-SZ",93,86,3826,0,1
JP-0126,Ibi-Sekigahara-Yoro Quasi-National Park,35.2942,136.509,PM85gh,JP-GF,171,131,8814,0,0
JP-0127,Hida-Kisogawa Quasi-National Park,35.7334,137.203,PM85or,"JP-AI,JP-GF",56,54,1750,0,1
JP-0128,Aichi Kogen Quasi-National Park,35.0331,137.41,PM85qa,JP-AI,117,107,3275,0,1
JP-0129,Mikawa Wan Quasi-National Park,34.8155,137.233,PM84ot,JP-AI,269,233,6067,0,2
JP-0130,Suzuka Quasi-National Park,35.0769,136.339,PM85eb,"JP-ME,JP-SH",50,45,1046,0,0
JP-0131,Muro-Akame-Aoyama Quasi-National Park,34.5597,136.092,PM84bn,"JP-ME,JP-NR",108,96,6486,0,2
JP-0132,Biwako Quasi-National Park,35.2377,136.166,PM85bf,"JP-KY,JP-SH",148,127,3989,0,2
JP-0133,Tango-Amanohashidate-Oeyama Quasi-National Park,35.5669,135.19,PM75on,JP-KY,30,27,1859,0,0
JP-0134,Kyoto Tamba Kogen Quasi-National Park,35.2765,135.589,PM75tg,JP-KY,18,16,490,0,0
JP-0135,Meiji no Mori Mino Quasi-National Park,34.8577,135.478,PM74ru,JP-OS,30,28,705,0,0
JP-0136,Kongo-Ikoma-Kisen Quasi-National Park,34.4607,135.687,PM74ul,"JP-NR,JP-OS,JP-WK",239,223,5840,0,3
JP-0137,Hyonosen-Ushiroyama-Nagisan Quasi-National Park,35.4969,134.471,PM75fl,"JP-HG,JP-OY,JP-TT",21,20,729,0,0
JP-0138,Yamato-Aogaki Quasi-National Park,34.5394,135.857,PM74wm,JP-NR,17,17,571,0,0
JP-0139,Koya-Ryujin Quasi-National Park,34.0765,135.56,PM74sb,"JP-NR,JP-WK",44,43,1053,0,1
JP-0140,Hiba-Dogo-Taishaku Quasi-National Park,35.0732,133.057,PM65mb,"JP-HS,JP-SM,JP-TT",15,14,503,0,0
JP-0141,Nishi-Chugoku Sanchi Quasi-National Park,34.5624,132.025,PM64an,"JP-HS,JP-SM,JP-YC",31,23,1536,0,0
JP-0142,Kita-Nagato Kaigan Quasi-National Park,34.5321,131.499,PM54rm,JP-YC,15,15,1200,0,0
JP-0143,Akiyoshidai Quasi-National Park,34.2499,131.304,PM54pf,JP-YC,10,10,588,0,5
JP-0144,Tsurugisan Quasi-National Park,33.9177,133.805,PM63vw,"JP-KC,JP-TS",31,26,3055,0,0
JP-0145,Muroto-Anan Kaigan Quasi-National Park,33.8353,134.747,PM73iu,"JP-KC,JP-TS",61,60,3718,0,0
JP-0146,Ishizuchi Quasi-National Park,33.7667,133.114,PM63ns,"JP-EH,JP-KC",10,9,473,0,0
JP-0147,Kitakyushu Quasi-National Park,33.8461,130.794,PM53ju,JP-FO,13,12,824,0,0
JP-0148,Genkai Quasi-National Park,33.58,130.097,PM53bn,"JP-FO,JP-NS,JP-SG",20,15,533,0,1
JP-0149,Yaba-Hita-Hikosan Quasi-National Park,33.5144,131.005,PM53mm,"JP-FO,JP-KM,JP-OT",14,13,605,0,0
JP-0150,Iki-Tsushima Quasi-National Park,33.7412,129.708,PM43ur,JP-NS,5,5,210,0,1
JP-0151,Kyushu Chuo Sanchi Quasi-National Park,32.5319,131.023,PM52mm,"JP-KM,JP-MZ",8,6,290,0,0
JP-0152,Nippo Kaigan Quasi-National Park,33.0578,132.007,PM63ab,"JP-MZ,JP-OT",27,24,1546,0,1
JP-0153,Sobo-Katamuki Quasi-National Park,32.8359,131.431,PM52ru,"JP-MZ,JP-OT",8,6,349,0,0
JP-0154,Nichinan Kaigan Quasi-National Park,31.8034,131.469,PM51rt,"JP-KS,JP-MZ",62,60,1771,0,3
JP-0155,Koshikishima Quasi-National Park,31.8617,129.877,PM41wu,JP-KS,6,6,798,0,0
JP-0156,Okinawa Kaigan Quasi-National Park,26.778,128.213,PL46cs,JP-ON,18,17,674,0,1
JP-0157,Okinawa Senseki Quasi-National Park,26.088,127.699,PL36uc,JP-ON,13,11,201,0,0
JP-0201,Takino Suzuran Hillside National Government Park,42.9109,141.38,QN02qv,JP-HK,5,5,110,0,0
JP-0202,Michinoku Lakewood National Government Park,38.1848,140.672,QM08ie,JP-MG,19,19,612,0,0
JP-0203,Hitachi Seaside National Government Park,36.4029,140.598,QM06hj,JP-IB,13,11,229,0,1
JP-0204,Musashi-Kyuryo National Government Park,36.0836,139.369,PM96qc,JP-ST,18,18,450,0,0
JP-0205,Showa Kinen National Government Park,35.7108,139.396,PM95qr,JP-TK,67,54,1290,0,8
JP-0206,The Tokyo Rinkai Disaster Prevention National Government Park,35.6355,139.796,PM95vp,JP-TK,56,49,770,0,2
JP-0207,Echigo Hillside National Government Park,37.4174,138.746,PM97ik,JP-NI,8,7,185,0,0
JP-0208,Alps Azumino National Government Park,36.315,137.842,PM86wh,JP-NN,42,41,923,0,2
JP-0209,Kiso Sansen National Government Park,35.3578,136.813,PM85ji,"JP-AI,JP-GF,JP-ME",203,171,4745,0,7
JP-0210,Yodogawa Riverside National Government Park,34.7446,135.558,PM74sr,"JP-KY,JP-OS",55,53,1203,0,0
JP-0211,Akashi Kaikyo National Government Park,34.5628,135.011,PM74mn,JP-HG,8,8,166,0,0
JP-0213,Asuka Historical National Government Park,34.4654,135.804,PM74vl,JP-NR,18,18,368,0,2
JP-0214,Bihoku Hillside National Government Park,34.8385,132.997,PM64lu,JP-HS,6,6,157,0,0
JP-0215,Sanuki Manno National Government Park,34.1648,133.891,PM64wd,JP-KG,6,6,142,0,0
JP-0216,Uminonakamichi Seaside National Government Park,33.655,130.356,PM53ep,JP-FO,9,8,165,0,0
JP-0217,Yoshinogari Historical National Government Park,33.3242,130.384,PM53eh,JP-SG,6,6,154,0,0
JP-0218,Okinawa Kinen National Government Park,26.6919,127.88,PL36wq,JP-ON,8,7,157,0,0
JP-1001,Akkeshi-Kiritappu-Konbumori Quasi-National Park,43.0169,144.838,QN23ka,JP-HK,10,8,400,0,0
JP-1002,Furano-Ashibetsu Prefectural Nature Park,43.2133,142.284,QN13df,JP-HK,24,24,533,0,1
JP-1003,Hiyama Prefectural Nature Park,41.8689,140.114,QN01bu,JP-HK,6,6,311,0,1
JP-1004,Esan Prefectural Nature Park,41.815,141.173,QN01ot,JP-HK,5,4,103,0,0
JP-1005,Notsuke-Furen Prefectural Nature Park,43.6049,145.284,QN23po,JP-HK,5,5,195,0,0
JP-1006,Matsumae-Yagoshi Prefectural Nature Park,41.3983,140.199,QN01cj,JP-HK,5,5,219,0,0
JP-1007,North Okhotsk Prefectural Nature Park,45.1472,142.37,QN15ed,JP-HK,3,3,185,0,0
JP-1008,Nopporo Shinrin Kouen Prefectural Nature Park,43.0525,141.501,QN03sb,JP-HK,10,10,277,0,1
JP-1009,Kariba-Motta Prefectural Nature Park,42.6097,139.853,PN92wo,JP-HK,6,6,304,0,0
JP-1010,Shumarinai Prefectural Nature Park,44.3083,142.181,QN14ch,JP-HK,5,5,286,0,1
JP-1011,Teshiodake Prefectural Nature Park,43.9875,142.861,QN13kx,JP-HK,2,2,105,0,0
JP-1012,Sharidake Prefectural Nature Park,43.7617,144.723,QN23is,JP-HK,2,2,77,0,0
JP-1013,Makomanai Prefectural Park,42.9957,141.344,QN02qx,JP-HK,12,11,245,0,0
JP-1014,Hokkaido kodomo no kuni Prefectural Park,43.524,141.94,QN03xm,JP-HK,11,7,211,0,0
JP-1015,Nopporo Sports Prefectural Park,43.0692,141.531,QN03sb,JP-HK,9,8,214,0,0
JP-1016,Okhotsk Prefectural Park,43.9902,144.243,QN23cx,JP-HK,8,6,167,0,0
JP-1017,Okhotsk Sea Ice Prefectural Park,44.3167,143.394,QN14qh,JP-HK,7,5,207,0,0
JP-1018,Soya Fureai Prefectural Park,45.3942,141.757,QN05vj,JP-HK,8,7,679,0,0
JP-1019,Sunpillar Prefectural Park,44.3739,142.479,QN14fi,JP-HK,3,3,56,0,0
JP-1020,Yumenomori Prefectural Park,43.5688,144.956,QN23ln,JP-HK,6,5,103,0,0
JP-1021,Tokachi Ecology Prefectural Park,42.9336,143.31,QN12pw,JP-HK,9,5,144,0,0
JP-1022,South Hokkaido Shiki no Mori Prefectural Park,41.8489,140.768,QN01ju,JP-HK,5,4,154,0,0
JP-1023,Volcano Bay Panorama Prefectural Park,42.2268,140.314,QN02df,JP-HK,6,6,191,0,0
JP-1024,Asamushi-Natsudomari Prefectural Nature Park,40.9981,140.893,QN00kx,JP-AO,12,12,549,0,0
JP-1025,Owani Ikarigaseki Onsenkyo Prefectural Nature Park,40.4092,140.644,QN00hj,JP-AO,13,13,415,0,1
JP-1026,Nakuidake Prefectural Nature Park,40.3879,141.308,QN00pj,JP-AO,8,8,335,0,0
JP-1027,Ashinochishogun Prefectural Nature Park,40.9136,140.452,QN00fv,JP-AO,13,12,483,0,0
JP-1028,Kuroishi Onsenkyo Prefectural Nature Park,40.5681,140.732,QN00in,JP-AO,11,11,444,0,0
JP-1029,Iwaki Kogen Prefectural Nature Park,40.6144,140.305,QN00do,JP-AO,13,13,456,0,1
JP-1030,Tsugaru Shirakami Prefectural Nature Park,40.6294,140.111,QN00bp,JP-AO,7,6,313,0,0
JP-1031,New Aomori Prefectural Sports Prefectural Park,40.8428,140.841,QN00ku,JP-AO,8,8,198,0,0
JP-1033,Hanamaki Onsenkyo Prefectural Nature Park,39.4489,141.073,QM09mk,JP-IW,12,12,422,0,0
JP-1034,Kuji-Hiraniwa Prefectural Nature Park,40.0839,141.508,QN00sc,JP-IW,8,7,385,0,0
JP-1035,Sotoyama-Hayasaka Heights Prefectural Nature Park,39.8183,141.378,QM09qt,JP-IW,13,12,423,0,0
JP-1036,Yuda Onsenkyo Prefectural Nature Park,39.3406,140.79,QM09ji,JP-IW,12,11,338,0,0
JP-1037,Orizume-Basenkyo Prefectural Nature Park,40.251,141.276,QN00pg,JP-IW,12,11,633,0,0
JP-1038,Goyozan Prefectural Nature Park,39.203,141.729,QM09ue,JP-IW,33,28,910,0,3
JP-1039,Murone Kogen Prefectural Nature Park,38.9739,141.446,QM08rx,JP-IW,18,12,298,0,0
JP-1040,Goshoko Koiki Prefectural Park,39.6676,140.978,QM09lq,JP-IW,16,15,620,0,0
JP-1041,Takizawa Forest Prefectural Park,39.8067,141.138,QM09nt,JP-IW,9,9,279,0,0
JP-1042,Hanamaki Koiki Prefectural Park,39.4335,141.056,QM09mk,JP-IW,11,11,246,0,0
JP-1043,Uchimaru Ryokuchi Prefectural Park,39.7026,141.153,QM09nq,JP-IW,6,6,125,0,0
JP-1044,Zao Kogen Prefectural Nature Park,38.0819,140.549,QM08gb,JP-MG,17,16,648,0,2
JP-1045,Abukuma Keikoku Prefectural Nature Park,37.8333,140.715,QM07it,JP-MG,23,23,902,0,0
JP-1046,Futakuchi Kyokoku Prefectural Nature Park,38.2737,140.601,QM08hg,JP-MG,18,18,666,0,0
JP-1047,Funagatarenpo Prefectural Nature Park,38.4503,140.631,QM08hk,JP-MG,24,24,754,0,2
JP-1048,Matsushima Prefectural Nature Park,38.3533,141.064,QM08mi,JP-MG,74,72,2004,0,0
JP-1049,Asahiyama Prefectural Nature Park,38.4883,141.181,QM08ol,JP-MG,14,13,678,0,0
JP-1050,Kenjosan Mangokuura Prefectural Nature Park,38.4058,141.401,QM08qj,JP-MG,38,33,1122,0,1
JP-1051,Kesennuma Prefectural Nature Park,38.8608,141.499,QM08ru,JP-MG,29,28,963,0,1
JP-1052,Matsushima Koen Prefectural Park,38.3661,141.061,QM08mi,JP-MG,20,20,456,0,0
JP-1053,Miyaginohara Prefectural Park,38.2564,140.902,QM08kg,JP-MG,22,21,413,0,0
JP-1054,Sendaiko Tagajo Chiku Kansho Ryokuchi Prefectural Park,38.2895,141.033,QM08mg,JP-MG,18,18,433,0,0
JP-1055,Yamoto Kaihin Ryokuchi Prefectural Park,38.4053,141.238,QM08oj,JP-MG,12,12,368,0,1
JP-1056,Iwanuma Kaihin Ryokuchi Prefectural Park,38.1187,140.932,QM08lc,JP-MG,23,23,512,0,0
JP-1057,Kasenuma Prefectural Park,38.3124,140.986,QM08lh,JP-MG,12,12,291,0,0
JP-1058,Miyagi Sports Prefectural Park,38.3354,140.953,QM08li,JP-MG,12,12,336,0,0
JP-1059,Hachimori Iwadate Prefectural Nature Park,40.37,140.01,QN00ai,JP-AK,11,10,332,0,0
JP-1060,Akita Shirakami Prefectural Nature Park,40.42,140.12,QN00bk,JP-AK,8,8,342,0,1
JP-1061,Tashirodake Prefectural Nature Park,40.43,140.41,QN00ek,JP-AK,4,4,235,0,0
JP-1062,Kimimachi-zaka Prefectural Nature Park,40.2214,140.256,QN00df,JP-AK,9,8,269,0,1
JP-1063,Moriyoshizan Prefectural Nature Park,39.98,140.54,QM09gx,JP-AK,7,5,305,0,0
JP-1064,Taiheizan Prefectural Nature Park,39.79,140.31,QM09ds,JP-AK,15,12,342,0,0
JP-1065,Tazawako Dakigaeri Prefectural Nature Park,39.73,140.66,QM09hr,JP-AK,16,15,519,0,0
JP-1066,Magi Mahiru Prefectural Nature Park,39.5375,140.69,QM09im,JP-AK,11,10,255,0,0
JP-1067,Akita Prefectural Central Prefectural Park,39.6231,140.204,QM09co,JP-AK,12,10,344,0,0
JP-1068,Hokuo no Mori Prefectural Park,40.1645,140.367,QN00ed,JP-AK,8,8,185,0,0
JP-1069,Koizumigata Prefectural Park,39.8136,140.07,QM09at,JP-AK,12,10,292,0,0
JP-1070,Shonai Kaihin Prefectural Nature Park,38.8513,139.787,PM98vu,JP-YT,19,19,763,0,1
JP-1071,Goshozan Prefectural Nature Park,38.4555,140.614,QM08hk,JP-YT,40,39,1631,0,2
JP-1072,Kennan Prefectural Nature Park,38.0034,140.205,QM08ca,JP-YT,21,20,979,0,3
JP-1073,Kabusan Prefectural Nature Park,38.9905,140.389,QM08ex,JP-YT,13,13,689,0,0
JP-1074,Tendo Kogen Prefectural Nature Park,38.349,140.452,QM08fi,JP-YT,93,93,3716,0,6
JP-1075,Mogamigawa Prefectural Nature Park,38.7565,140.051,QM08as,JP-YT,15,14,687,0,0
JP-1076,Yamagata Prefectural General Sports Prefectural Park,38.3361,140.377,QM08ei,JP-YT,77,76,2717,0,3
JP-1077,Nishizao Prefectural Park,38.205,140.355,QM08ee,JP-YT,26,24,916,0,2
JP-1078,Yumiharidaira Prefectural Park,38.4761,140.003,QM08al,JP-YT,13,13,416,0,1
JP-1079,Nakayama Prefectural Park,38.3421,140.267,QM08di,JP-YT,19,19,767,0,1
JP-1080,Mogamigawa Furusato Sogo Prefectural Park,38.3652,140.263,QM08di,JP-YT,24,20,659,0,0
JP-1081,Mogami Central Prefectural Park,38.7601,140.308,QM08ds,JP-YT,9,9,288,0,1
JP-1082,Zao Miharashi no Oka Museum Prefectural Park,38.1879,140.295,QM08de,JP-YT,18,16,620,0,0
JP-1083,Kenko no Mori Prefectural Park,38.3003,140.345,QM08eh,JP-YT,69,64,2469,0,4
JP-1084,Yuso no Oka Prefectural Park,38.2152,140.349,QM08ef,JP-YT,26,26,651,0,0
JP-1085,Shonai Kuko Kansho Ryokuchi Prefectural Park,38.816,139.792,PM98vt,JP-YT,16,13,441,0,0
JP-1086,Kenmin Ryokuchi Prefectural Park,38.2395,140.362,QM08ef,JP-YT,26,24,682,0,2
JP-1087,Kenseishi Ryokuchi Prefectural Park,38.2565,140.341,QM08eg,JP-YT,11,11,293,0,0
JP-1088,Ryozen Prefectural Nature Park,37.7765,140.677,QM07is,JP-FS,10,10,468,0,0
JP-1089,Kasumigajo Prefectural Nature Park,37.5991,140.429,QM07fo,JP-FS,14,13,555,0,0
JP-1090,Nanko Prefectural Nature Park,37.1097,140.22,QM07cc,JP-FS,26,25,869,0,1
JP-1091,Okukuji Prefectural Nature Park,36.9379,140.28,QM06dw,JP-FS,12,12,554,0,1
JP-1092,Iwaki Kaigan Prefectural Nature Park,37.1364,140.998,QM07ld,JP-FS,18,18,642,0,0
JP-1093,Matsukawaura Prefectural Nature Park,37.7981,140.976,QM07lt,JP-FS,17,17,668,0,0
JP-1094,Nakoso Prefectural Nature Park,36.8678,140.782,QM06ju,JP-FS,12,11,337,0,0
JP-1096,Okawa Hatori Prefectural Nature Park,37.2615,140.07,QM07ag,JP-FS,134,130,3085,0,0
JP-1097,Abukuma Kogen Chubu Prefectural Nature Park,37.3549,140.698,QM07ii,JP-FS,21,20,1644,0,1
JP-1098,Natsuigawa Keikoku Prefectural Nature Park,37.1016,140.798,QM07jc,JP-FS,12,10,422,0,1
JP-1099,Azuma Sports Prefectural Park,37.7201,140.36,QM07er,JP-FS,13,13,560,0,0
JP-1100,Ouse Prefectural Park,37.4128,140.274,QM07dj,JP-FS,16,16,483,0,0
JP-1101,Fukushima Airport Prefectural Park,37.2467,140.42,QM07ff,JP-FS,14,13,384,0,0
JP-1102,Azumagaoka Prefectural Park,37.6313,140.969,QM07lp,JP-FS,11,11,387,0,0
JP-1103,Iwaki Prefectural Park,37.0108,140.92,QM07la,JP-FS,8,8,215,0,0
JP-1104,Hirono Bosai Ryokuchi Prefectural Park,37.2087,141.004,QM07mf,JP-FS,6,6,128,0,0
JP-1105,Aizu Recreation Prefectural Park,37.515,140.018,QM07am,JP-FS,23,23,645,0,1
JP-1106,Hanazono Hananuki Prefectural Nature Park,36.8348,140.703,QM06iu,JP-IB,12,11,341,0,0
JP-1107,Takasuzu Prefectural Nature Park,36.6143,140.589,QM06ho,JP-IB,22,19,645,0,1
JP-1108,Ota Prefectural Nature Park,36.5418,140.514,QM06gn,JP-IB,11,10,319,0,0
JP-1109,Okukuji Prefectural Nature Park,36.9269,140.263,QM06dw,JP-IB,26,22,612,0,0
JP-1110,Oarai Prefectural Prefectural Nature Park,36.3591,140.614,QM06hi,JP-IB,72,22,792,0,1
JP-1111,Mito Prefectural Nature Park,36.3724,140.46,QM06fi,JP-IB,30,28,801,0,0
JP-1112,Gozenyama Prefectural Nature Park,36.5448,140.324,QM06dn,JP-IB,14,13,384,0,0
JP-1113,Wagakuni Atago Prefectural Nature Park,36.3047,140.225,QM06ch,JP-IB,37,33,1144,0,0
JP-1114,Kasama Prefectural Nature Park,36.3837,140.268,QM06dj,JP-IB,28,28,1299,0,1
JP-1115,Kairakuen Prefectural Park,36.3725,140.452,QM06fi,JP-IB,15,15,327,0,0
JP-1116,Kodokan Prefectural Park,36.3761,140.478,QM06fj,JP-IB,13,12,178,0,0
JP-1117,Oarai Prefectural Park,36.3257,140.593,QM06hh,JP-IB,17,16,548,0,1
JP-1118,Kasama Geijutsu no mori Prefectural Park,36.3715,140.266,QM06di,JP-IB,15,15,303,0,0
JP-1119,Minato Prefectural Park,35.9134,140.672,QM05iv,JP-IB,23,23,631,0,0
JP-1120,Kashimanada Sea Side Prefectural Park,36.1505,140.577,QM06gd,JP-IB,18,16,503,0,1
JP-1121,Daigo Koiki Prefectural Park,36.7915,140.35,QM06es,JP-IB,10,10,320,0,0
JP-1123,Sanuma Koiki Prefectural Park,36.1891,139.948,PM96xe,JP-IB,30,28,568,0,0
JP-1124,Kensei Sogo Prefectural Park,36.3052,140.017,QM06ah,JP-IB,40,36,750,0,1
JP-1125,Kasamatsu Sports Prefectural Park,36.455,140.539,QM06gk,JP-IB,59,21,514,0,0
JP-1126,Horihara Sports Prefectural Park,36.3984,140.44,QM06fj,JP-IB,16,16,342,0,1
JP-1128,Mae Nikko Prefectural Nature Park,36.623,139.521,PM96so,JP-TC,58,50,2710,0,2
JP-1129,Yamizo Prefectural Nature Park,36.7838,140.144,QM06bs,JP-TC,42,37,1084,0,1
JP-1130,Nakagawa Prefectural Nature Park,36.5978,140.188,QM06co,JP-TC,20,19,825,0,1
JP-1131,Mashiko Prefectural Nature Park,36.4661,140.119,QM06bl,JP-TC,23,22,904,0,1
JP-1132,Ohirasan Prefectural Nature Park,36.3599,139.698,PM96ui,JP-TC,199,143,3111,0,2
JP-1133,Karasawayama Prefectural Nature Park,36.3538,139.6,PM96ti,JP-TC,56,45,1430,0,1
JP-1134,Ashikaga Prefectural Nature Park,36.3798,139.442,PM96rj,JP-TC,59,53,2988,0,8
JP-1135,Utsunomiya Prefectural Nature Park,36.6059,139.81,PM96vo,JP-TC,47,45,3177,0,2
JP-1136,Tochigi Sports Prefectural Park,36.5109,139.859,PM96wm,JP-TC,19,18,374,0,1
JP-1137,Igashira Prefectural Park,36.4944,139.997,PM96xl,JP-TC,18,17,409,0,0
JP-1138,Kinu Green Prefectural Park,36.6302,139.957,PM96xp,JP-TC,15,14,352,0,1
JP-1139,Tochigi Central Prefectural Park,36.5583,139.863,PM96wn,JP-TC,17,17,339,0,0
JP-1140,Nasunogahara Prefectural Park,36.9323,139.949,PM96xw,JP-TC,13,12,289,0,1
JP-1141,Mikamoyama Prefectural Park,36.3053,139.627,PM96th,JP-TC,37,32,821,0,1
JP-1142,Nikko Tamozawa Implerial Villa Memorial Prefectural Park,36.7524,139.591,PM96ts,JP-TC,11,11,196,0,0
JP-1143,Nikko Daiyagawa Prefectural Park,36.7353,139.663,PM96tr,JP-TC,12,12,248,0,1
JP-1144,Tochigi Wanpaku Prefectural Park,36.4587,139.808,PM96vl,JP-TC,24,20,558,0,0
JP-1145,Sayama Prefectural Nature Park,35.7777,139.416,PM95qs,JP-ST,117,100,3431,0,28
JP-1146,Okumusashi Prefectural Nature Park,35.9061,139.19,PM95ov,JP-ST,275,230,9615,1,52
JP-1147,Kuroyama Prefectural Nature Park,35.9592,139.236,PM95ox,JP-ST,341,302,30683,0,50
JP-1148,Nagatoro Tamayodo Prefectural Nature Park,36.0949,139.115,PM96nc,JP-ST,314,280,16411,0,14
JP-1149,Hikikyuryo Prefectural Nature Park,36.0004,139.364,PM96qa,JP-ST,104,95,4029,0,9
JP-1150,Jobu Prefectural Nature Park,36.1292,139.023,PM96md,JP-ST,47,43,1699,0,0
JP-1151,Buko Prefectural Nature Park,35.9539,139.013,PM95mw,JP-ST,128,108,3951,0,12
JP-1152,Angyo Bunan Prefectural Nature Park,35.8541,139.735,PM95uu,JP-ST,80,75,2077,0,16
JP-1153,Ryogami Prefectural Nature Park,36,138.927,PM96la,JP-ST,19,19,603,0,1
JP-1154,Nishichichibu Prefectural Nature Park,36.0615,138.963,PM96lb,JP-ST,43,40,1971,0,2
JP-1155,Kitaurawa Prefectural Park,35.8699,139.644,PM95tu,JP-ST,56,42,874,0,1
JP-1156,Saitama Stadium 2002 Prefectural Park,35.903,139.715,PM95uv,JP-ST,27,27,540,0,1
JP-1157,Akigase Prefectural Park,35.8499,139.602,PM95tu,JP-ST,129,119,4653,0,36
JP-1158,Omiya Prefectural Park,35.9187,139.631,PM95tw,JP-ST,69,61,1883,0,8
JP-1159,Shirakobato Suijo Prefectural Park,35.9134,139.749,PM95uv,JP-ST,23,23,635,0,1
JP-1160,Ageo Undo Prefectural Park,35.9684,139.602,PM95tx,JP-ST,36,34,743,0,2
JP-1162,Kumagaya Sports & Culture Prefectural Park,36.1665,139.405,PM96qd,JP-ST,20,20,645,0,3
JP-1163,Yoshimi Athletic Prefectural Park,36.0575,139.472,PM96rb,JP-ST,46,45,1849,0,3
JP-1164,Saitama Prefectural Forest Prefectural Park,35.9895,139.157,PM95nx,JP-ST,62,53,1986,0,5
JP-1165,Wako Jurin Prefectural Park,35.7773,139.599,PM95ts,JP-ST,52,49,1146,0,32
JP-1166,Sainomori Iruma Prefectural Park,35.8376,139.399,PM95qu,JP-ST,46,43,1173,0,2
JP-1167,Kazo Hanasaki Prefectural Park,36.1012,139.633,PM96tc,JP-ST,21,20,432,0,0
JP-1168,Matsubushi Midorinooka Prefectural Park,35.9458,139.81,PM95vw,JP-ST,36,36,897,0,1
JP-1169,Hanyu Suigo Prefectural Park,36.1716,139.595,PM96te,JP-ST,21,21,510,0,0
JP-1170,Gongendo Prefectural Park,36.1076,139.725,PM96uc,JP-ST,26,24,511,0,0
JP-1171,Kukisyobu Prefectural Park,36.0543,139.646,PM96tb,JP-ST,25,23,598,0,2
JP-1172,Yoshikawa Prefectural Park,35.911,139.873,PM95wv,JP-ST,30,27,817,0,2
JP-1173,Misato Prefectural Park,35.7846,139.873,PM95ws,JP-ST,48,45,1142,0,2
JP-1174,Kawagoe Prefectural Park,35.9134,139.451,PM95rv,JP-ST,172,162,3424,0,5
JP-1175,Kodomo Dobutsu Prefectural Park,35.997,139.374,PM95qx,JP-ST,21,21,706,0,1
JP-1176,Kitamoto Shizen Kansatsu Prefectural Park,36.0108,139.509,PM96sa,JP-ST,28,26,925,0,2
JP-1177,Arakawa Oaso Prefectural Park,36.1434,139.349,PM96qd,JP-ST,26,24,858,0,1
JP-1178,Sakitama Kofun Prefectural Park,36.1277,139.475,PM96rd,JP-ST,36,33,1163,0,3
JP-1179,Toda Prefectural Park,35.8017,139.676,PM95ut,JP-ST,42,40,904,0,6
JP-1180,Tokorozawa Aviation Memorial Prefectural Park,35.7976,139.474,PM95rt,JP-ST,116,102,3047,0,132
JP-1181,Sayama Inariyama Prefectural Park,35.8475,139.397,PM95qu,JP-ST,48,43,835,0,2
JP-1182,Yoro Keikoku Okukiyosumi Prefectural Nature Park,35.2517,140.163,QM05bg,JP-CH,16,14,397,0,0
JP-1183,Kujukuri Prefectural Nature Park,35.4473,140.404,QM05ek,JP-CH,69,64,2556,0,6
JP-1184,Inba Tega Prefectural Nature Park,35.7566,140.189,QM05cs,JP-CH,129,115,3520,0,8
JP-1185,Takagoyama Prefectural Nature Park,35.198,139.993,PM95xe,JP-CH,38,35,1011,0,0
JP-1186,Mineoka Sankei Prefectural Nature Park,35.106,140.01,QM05ac,JP-CH,24,22,841,0,1
JP-1187,Tomisan Prefectural Nature Park,35.0953,139.882,PM95wc,JP-CH,32,31,892,0,1
JP-1188,Otone Prefectural Nature Park,35.9151,140.468,QM05fv,JP-CH,29,29,995,0,2
JP-1189,Kasamori Tsurumai Prefectural Nature Park,35.3995,140.201,QM05cj,JP-CH,54,48,1757,0,6
JP-1190,Hagoromo Prefectural Park,35.6037,140.123,QM05bo,JP-CH,14,13,206,0,0
JP-1191,Aobanomori Prefectural Park,35.5965,140.141,QM05bo,JP-CH,55,50,1291,0,1
JP-1192,Chiba Central Sports Center Prefectural Park,35.6503,140.126,QM05bp,JP-CH,36,35,1211,0,1
