reference,name,latitude,longitude,grid,locationDesc,attempts,activations,qsos,my_activations,my_hunted_qsos
JP-1819,Minato-ga-oka Port Prefectural Park,35.5963,139.763,PM95vo,JP-TK,37,36,696,0,1
JP-1820,Tokai Port Prefectural Park,35.5777,139.756,PM95vn,JP-TK,41,37,607,0,0
JP-1821,Keihinjima Tsubasa Prefectural Park,35.5701,139.77,PM95vn,JP-TK,40,36,654,0,1
JP-1822,Shibaura Minami Port Prefectural Park,35.637,139.76,PM95vp,JP-TK,22,21,496,0,1
JP-1823,Keihin Canalside Greenway Prefectural Park,35.5972,139.749,PM95uo,JP-TK,35,32,564,0,0
JP-1824,Oi Port Greenway Prefectural Park,35.5997,139.755,PM95vo,JP-TK,23,21,327,0,0
JP-1825,Tokai Greenway Prefectural Park,35.5772,139.759,PM95vn,JP-TK,26,24,335,0,1
JP-1826,Jonanjima Greenway Prefectural Park,35.5794,139.781,PM95vn,JP-TK,26,23,432,0,1
JP-1827,Keihinjima Greenway Prefectural Park,35.5652,139.765,PM95vn,JP-TK,25,23,399,0,0
JP-1828,Lake Okutama Hotori Prefectural Park,35.7663,139.022,PM95ms,JP-TK,26,26,988,0,2
JP-1829,Komine Prefectural Park,35.7197,139.23,PM95or,JP-TK,46,44,1489,0,6
JP-1830,Oshima Prefectural Park,34.7613,139.434,PM94rs,JP-TK,10,10,621,0,0
JP-1831,Takowan Prefectural Park,34.2039,139.152,PM94ne,JP-TK,4,4,160,0,1
JP-1832,Habushiura Prefectural Park,34.3782,139.273,PM94pj,JP-TK,3,3,276,0,0
JP-1833,Hachijo Botanical Garden Prefectural Park,33.1106,139.782,PM93vc,JP-TK,6,5,312,0,1
JP-1834,Chichibu Muse Prefectural Park,35.9962,139.055,PM95mx,JP-ST,32,30,1423,0,4
JP-1835,Niiza Greenway Prefectural Park,35.7779,139.592,PM95ts,JP-ST,32,28,620,0,15
JP-1836,Shinrinkoen Park Walking Road Prefectural Park,36.0471,139.375,PM96qb,JP-ST,23,21,934,0,0
JP-1837,Sakitama Greenway Prefectural Park,36.0892,139.48,PM96rc,JP-ST,19,18,400,0,6
JP-1838,Hananosato Greenway Prefectural Park,36.094,139.491,PM96rc,JP-ST,20,20,503,0,3
JP-1839,Akigase Greenway Prefectural Park,35.8525,139.634,PM95tu,JP-ST,27,27,1115,0,7
JP-1842,Saitama Prefectural Citizens Health and Welfare Village Prefectural Park,35.8842,139.758,PM95vv,JP-ST,34,33,740,0,2
JP-1843,Saitamaken Agricultual and Forestry Prefectural Park,36.1123,139.288,PM96pc,JP-ST,21,21,765,0,1
JP-1845,Ikaho Forest Prefectural Park,36.4822,138.912,PM96kl,JP-GM,31,26,953,0,3
JP-1846,Akagi Forest Prefectural Park,36.5051,139.155,PM96nm,JP-GM,15,12,286,0,2
JP-1847,Akagi Community Forest Prefectural Park,36.5228,139.145,PM96nm,JP-GM,13,10,191,0,1
JP-1848,Sakuranosato Forest Prefectural Park,36.2827,138.744,PM96ig,JP-GM,12,12,288,0,1
JP-1849,Sakurayama Forest Prefectural Park,36.1614,139.021,PM96md,JP-GM,17,17,579,0,1
JP-1850,Mikabo Forest Prefectural Park,36.151,138.863,PM96kd,JP-GM,15,13,430,0,1
JP-1851,Gunma Forest Park 21st Century Prefectural Park,36.739,139.084,PM96nr,JP-GM,9,9,266,0,1
JP-1852,Gunma Insect World Forest Prefectural Park,36.436,139.251,PM96pk,JP-GM,20,16,436,0,1
JP-1853,Gunma Flower Prefectural Park,36.4557,139.177,PM96ok,JP-GM,8,8,162,0,1
JP-1854,Oura no Mori Forest Prefectural Park,36.265,139.487,PM96rg,JP-GM,28,26,516,0,0
JP-1855,Oneyama Bird Forest Prefectural Park,36.3524,138.738,PM96ii,JP-GM,11,11,260,0,0
JP-1856,Shinohara Garden Prefectural Park,35.4913,139.626,PM95tl,JP-KN,74,69,1859,0,0
JP-1857,Midorinomura Agricultual and Forestry Prefectural Park,36.0366,138.982,PM96la,JP-ST,21,20,1076,0,2
JP-1858,Saino-Kuni Fureai Forest Prefectural Park,35.9947,138.801,PM95jx,JP-ST,13,13,312,0,0
JP-1859,Tochigi Prefectual Forest Prefectural Park,36.8739,139.841,PM96wu,JP-TC,26,24,1689,0,0
JP-1860,Italian Embassy Villa Memorial Prefectural Park,36.725,139.486,PM96rr,JP-TC,5,5,86,0,0
JP-1861,British Embassy Villa Memorial Prefectural Park,36.7266,139.486,PM96rr,JP-TC,5,5,72,0,0
JP-1862,Otosan Prefectural Nature Park,33.7272,135.714,PM73ur,JP-WK,1,1,17,0,0
JP-1863,Choukai-no-mori Prefectural Park,38.8593,139.98,PM98xu,JP-YT,9,9,387,0,1
JP-1864,Genryu-no-mori Prefectural Park,37.9256,139.899,PM97ww,JP-YT,6,6,274,0,0
JP-1865,Kenmin-no-mori Prefectural Park,38.242,140.203,QM08cf,JP-YT,9,9,517,0,0
JP-1866,Yugaku-no-mori Prefectural Park,38.9127,140.376,QM08ev,JP-YT,11,11,359,0,0
JP-1867,Yamagata Nature Museum Prefectural Park,38.5044,139.998,PM98xm,JP-YT,16,16,935,0,0
JP-1868,Rinkuu-kouen Prefectural Park,38.1361,140.9,QM08kd,JP-MG,40,40,1023,0,0
JP-1869,Kenmin-no-mori Prefectural Park,38.3215,140.937,QM08lh,JP-MG,11,10,394,0,0
JP-1870,Forest Park Adatara Prefectural Park,37.5815,140.329,QM07dn,JP-FS,9,9,393,0,0
JP-1871,Showa-no-mori Prefectural Park,37.5752,140.07,QM07an,JP-FS,15,15,472,0,1
JP-1872,Rachihama Bosai Ryokuchi Prefectural Park,37.8871,140.932,QM07lv,JP-FS,16,16,494,0,0
JP-1873,Haragamaobama Bosai Ryokuchi Prefectural Park,37.8313,140.956,QM07lt,JP-FS,14,14,526,0,0
JP-1874,Hisanohama Bosai Ryokuchi Prefectural Park,37.1422,141,QM07md,JP-FS,3,3,66,0,0
JP-1875,Yotsukura Bosai Ryokuchi Prefectural Park,37.0991,140.987,QM07lc,JP-FS,4,4,72,0,0
JP-1876,Numanouchi Bosai Ryokuchi Prefectural Park,37.0135,140.974,QM07la,JP-FS,6,6,109,0,0
JP-1877,Usuiso Bosai Ryokuchi Prefectural Park,36.9999,140.979,QM06lx,JP-FS,7,7,107,0,0
JP-1878,Toyoma Bosai Ryokuchi Prefectural Park,36.9863,140.969,QM06lx,JP-FS,6,6,139,0,0
JP-1879,Nagasaki Bosai Ryokuchi Prefectural Park,36.9539,140.938,QM06lw,JP-FS,7,7,185,0,0
JP-1880,Iwama Bosai Ryokuchi Prefectural Park,36.9126,140.818,QM06jv,JP-FS,7,7,222,0,0
JP-1881,Kenmin-no-mori Prefectural Park,39.7206,140.696,QM09ir,JP-AK,11,11,345,0,0
JP-1883,Oita Prefecture Museum of History Prefectural Park,33.542,131.361,PM53qn,JP-OT,4,4,150,0,0
JP-1884,Oita Kenmin no Mori Prefectural Park,33.1594,131.547,PM53sd,JP-OT,12,10,542,0,0
JP-1885,Oita Agricultural Prefectural Park,33.4331,131.43,PM53rk,JP-OT,4,4,211,0,0
JP-1886,Expo '70 Commemorative Prefectural Park,34.8112,135.53,PM74st,JP-OS,20,18,398,0,1
JP-1887,Kenmin-no-mori Prefectural Park,39.8957,140.965,QM09lv,JP-IW,4,4,221,0,0
JP-1888,Senganishi Forest Prefectural Park,39.2217,141,QM09mf,JP-IW,12,11,555,0,0
JP-1889,Ohokuboyama Forest Prefectural Park,39.1702,141.757,QM09ve,JP-IW,11,9,360,0,1
JP-1890,Orizumedake Forest Prefectural Park,40.2684,141.373,QN00qg,JP-IW,3,3,187,0,0
JP-1891,Takatamatsubara Memorial Prefectural Park,39.0069,141.627,QM09ta,JP-IW,10,10,413,0,1
JP-1892,Ishinomakiminamihama Memorial Prefectural Park,38.4184,141.303,QM08pk,JP-MG,11,11,350,0,0
JP-1893,Fukushima Memorial Prefectural Park,37.4649,141.031,QM07ml,JP-FS,6,6,256,0,0
JP-1899,Kasukabe Yumeno-mori Prefectural Park,35.954,139.738,PM95uw,JP-ST,37,35,726,0,1
JP-1900,Chiba Prefectural Funabashi Forest Prefectural Park,35.7685,140.058,QM05as,JP-CH,18,18,589,0,4
JP-1901,Chiba Prefectural Tonosho Forest Prefectural Park,35.7808,140.676,QM05is,JP-CH,25,23,940,0,1
JP-1902,Chiba Prefectural Uchiurayama Forest Prefectural Park,35.1596,140.199,QM05cd,JP-CH,10,10,356,0,0
JP-1903,Tateyama Wild Bird Sanctuary Prefectural Park,34.9238,139.836,PM94ww,JP-CH,17,17,512,0,1
JP-1904,Chiba Prefectural Seiwa Forest Prefectural Park,35.1786,140.02,QM05ae,JP-CH,16,16,596,0,2
JP-1905,Chiba Prefectural Otaki Forest Prefectural Park,35.2824,140.235,QM05cg,JP-CH,18,17,962,0,1
JP-1906,Fuefukigawa Fruit Prefectural Park,35.7025,138.665,PM95hq,JP-YN,38,37,1568,0,3
JP-1907,Midorigaoka Sports Prefectural Park,35.6849,138.557,PM95gq,JP-YN,16,15,461,0,2
JP-1908,Kamanashigawa Sports Prefectural Park,35.6513,138.507,PM95gp,JP-YN,25,25,756,0,1
JP-1909,Yamanashi Prefectural Museum of Art Prefectural Park,35.6604,138.538,PM95gp,JP-YN,16,16,352,0,0
JP-1910,Maizuru Castle Prefectural Park,35.6647,138.571,PM95gp,JP-YN,8,8,137,0,1
JP-1911,Kofu Chu-ou Prefectural Park,35.66,138.568,PM95gp,JP-YN,5,5,87,0,0
JP-1912,Kofu Marunouchi Prefectural Park,35.6633,138.567,PM95gp,JP-YN,5,5,76,0,0
JP-1913,Midai Prefectural Park,35.6685,138.44,PM95fq,JP-YN,17,15,529,0,1
JP-1914,Kanegawano mori Provincial Forest Prefectural Park,35.6399,138.676,PM95ip,JP-YN,18,16,481,0,1
JP-1915,Katsuragawa Wellness Prefectural Park,35.6221,138.996,PM95lo,JP-YN,28,25,1075,0,2
JP-1916,Yamanashi Prefectural Makiba Prefectural Park,35.9257,138.408,PM95ew,JP-YN,20,20,592,0,1
JP-1917,Kiyosato Okanokouen Prefectural Park,35.9013,138.429,PM95fv,JP-YN,16,15,473,0,0
JP-1918,Aichiken ryokka center Prefectural Park,35.1693,137.2,PM85oe,JP-AI,27,25,836,0,2
JP-1919,Kainan Kodomonokuni Prefectural Park,35.0956,136.757,PM85jc,JP-AI,38,38,1205,0,3
JP-1920,AichiYatomi Yachouen Prefectural Park,35.0488,136.784,PM85jb,JP-AI,31,31,830,0,2
JP-1921,Aichi KenminnoMori Prefectural Park,35.007,137.623,PM85ta,JP-AI,19,19,467,0,0
JP-1922,Aichiken Forest Prefectural Park,35.2339,137.052,PM85mf,JP-AI,92,91,2574,0,0
JP-1923,Korogi Athletic Prefectural Park,35.1654,137.049,PM85md,JP-AI,28,28,777,0,1
JP-1924,LAGUNA BEACH Prefectural Park,34.8061,137.272,PM84pt,JP-AI,32,31,912,0,1
JP-1925,Kaisho Forest Prefectural Park,35.1888,137.111,PM85ne,JP-AI,24,23,577,0,1
JP-1926,Aichi Education and Sports Foundation Prefectural Park,35.302,136.846,PM85kh,JP-AI,34,30,966,0,1
JP-1927,Jindai Botanical Garden Prefectural Park,35.6715,139.548,PM95sq,JP-TK,38,36,738,0,7
JP-1928,Nakato Prefectural Park,35.7616,139.394,PM95qs,JP-TK,22,20,394,0,1
JP-1929,Takaido Prefectural Park,35.6842,139.604,PM95tq,JP-TK,37,33,700,0,4
JP-1930,Niigata Seishonen no Mori Prefectural Park,38.0278,139.502,PM98sa,JP-NI,5,5,175,0,0
JP-1931,Gozu Kenmin-no-mori Prefectural Park,37.7715,139.363,PM97qs,JP-NI,3,3,176,0,0
JP-1932,Mitsuke Sugisawa no Mori Prefectural Park,37.5277,138.989,PM97lm,JP-NI,6,6,180,0,0
JP-1933,Myoko Sanroku Kenmin-no-mori Prefectural Park,36.8573,138.097,PM96bu,JP-NI,7,7,255,0,0
JP-1934,komorebi no Mori Prefectural Park,38.7872,140.788,QM08js,JP-MG,4,4,162,0,1
JP-1935,Showa Manyo no Mori Prefectural Park,38.4695,140.881,QM08kl,JP-MG,6,5,299,0,0
JP-1936,Jomon no Mori Prefectural Park,38.4393,140.699,QM08ik,JP-MG,3,3,140,0,0
JP-1937,Forest Park Of Mie Prefectural Park,35.0468,136.479,PM85fb,JP-ME,18,16,414,0,1
JP-1938,Ueno Forest Prefectural Park,34.7429,136.149,PM84br,JP-ME,10,10,215,0,0
JP-1939,Ichinoyanomori Prefectural Park,35.8699,139.912,PM95wu,JP-CH,20,17,454,0,0
JP-1940,Kihoku Prefectural Park,34.3139,135.537,PM74sh,JP-WK,5,5,128,0,0
JP-1941,Wakayama Koutsuu Prefectural Park,34.2035,135.218,PM74oe,JP-WK,4,4,118,0,0
JP-1942,Ken-ei Fukushi Prefectural Park,34.535,135.784,PM74vm,JP-NR,7,6,114,0,0
JP-1944,Satsunankaigan Prefectural Nature Park,31.2473,130.433,PM51ff,JP-KS,3,3,157,0,0
JP-1945,Mishima Prefectural Park,30.7913,130.303,PM50ds,JP-KS,2,2,241,0,0
JP-1946,Tama Zoological Prefectural Park,35.6496,139.403,PM95qp,JP-TK,17,17,561,0,8
JP-1947,Hinohara Tokyo Citizens' Forest Prefectural Park,35.7393,139.029,PM95mr,JP-TK,54,49,1676,0,2
JP-1948,Okutama Tokyo Citizens' Forest Prefectural Park,35.7768,139.082,PM95ms,JP-TK,26,24,1037,0,4
JP-1949,Ibaraki Prefectural Okukuji Forest Prefectural Park,36.7649,140.462,QM06fs,JP-IB,6,6,159,0,0
JP-1950,Ibaraki Prefectural Suigo Forest Prefectural Park,35.9852,140.545,QM05gx,JP-IB,18,18,546,0,3
JP-1951,Osaka Prefectural Agricultural Prefectural Park,34.3868,135.391,PM74qj,JP-OS,7,7,119,0,0
JP-1952,Fumin-no-mori Kurondo Enchi Prefectural Park,34.7647,135.705,PM74us,JP-OS,8,8,173,0,1
JP-1953,Fumin-no-mori Hoshida Enchi Prefectural Park,34.7514,135.686,PM74us,JP-OS,9,8,193,0,0
JP-1954,Fumin-no-mori Muroike Enchi Prefectural Park,34.7287,135.667,PM74ur,JP-OS,10,10,266,0,0
JP-1955,Fumin-no-mori Kusaka Enchi Prefectural Park,34.691,135.668,PM74uq,JP-OS,6,6,121,0,0
JP-1956,Fumin-no-mori Nukata Enchi Prefectural Park,34.6772,135.673,PM74uq,JP-OS,6,6,126,0,0
JP-1957,Fumin-no-mori Narukawa Enchi Prefectural Park,34.6666,135.666,PM74tp,JP-OS,22,14,277,0,0
JP-1958,Fumin-no-mori Mizunomi Enchi Provincial Park,34.6375,135.659,PM74tp,JP-OS,41,39,858,0,0
JP-1959,Fumin-no-mori Chihaya Enchi Prefectural Park,34.4129,135.677,PM74uj,JP-OS,6,6,107,0,0
JP-1960,Fumin-no-mori Horigo Enchi Prefectural Park,34.3334,135.324,PM74pi,JP-OS,7,7,214,0,0
JP-1961,Chiba Port Prefectural Park,35.5991,140.099,QM05bo,JP-CH,75,75,2455,0,5
JP-1962,Sodegaura Kaihin Prefectural Park,35.4558,139.954,PM95xk,JP-CH,48,45,1605,0,2
JP-1963,Funabashi Port Shinsui Prefectural Park,35.6882,139.987,PM95xq,JP-CH,18,17,517,0,0
JP-1964,Shinminato Prefectural Park,35.3656,139.895,PM95wi,JP-CH,28,26,678,0,0
JP-1965,Shiohama Prefectural Park,35.3791,139.909,PM95wj,JP-CH,35,34,1166,0,2
JP-1966,Futtsuminato Prefectural Park,35.3223,139.819,PM95vh,JP-CH,33,33,1031,0,1
JP-1967,Naikou Prefectural Park,35.3868,139.916,PM95wj,JP-CH,29,29,720,0,0
JP-1968,Naikou Kita Prefectural Park,35.3885,139.915,PM95wj,JP-CH,22,21,501,0,0
JP-1969,Kazusa Minatoko Kaihin Prefectural Park,35.2241,139.871,PM95wf,JP-CH,29,29,885,0,0
JP-1970,Naaraiko Kaihin Prefectural Park,35.706,140.838,QM05kq,JP-CH,27,26,816,0,3
JP-1971,Okitsuko Kaihin Prefectural Park,35.1328,140.247,QM05cd,JP-CH,15,15,580,0,1
JP-1972,Senba Prefectural Park,36.3682,140.467,QM06fi,JP-IB,10,10,138,0,0
JP-1973,Kencho Higashi Park SHIBA Prefectural Park,36.3411,140.449,QM06fi,JP-IB,9,8,132,0,0
JP-1974,Sawatarigawa Ryokuchi Prefectural Park,36.3807,140.447,QM06fj,JP-IB,9,9,156,0,0
JP-1975,Sakuragawa Ryokuchi Prefectural Park,36.3639,140.444,QM06fi,JP-IB,10,10,171,0,0
JP-1976,Kitauragawa Ryokuchi Prefectural Park,35.9077,140.116,QM05bv,JP-IB,18,17,488,0,1
JP-1977,Geidai Ryokuchi Prefectural Park,35.8838,140.11,QM05bv,JP-IB,8,8,205,0,0
JP-1978,Akatsuka (JP-IB) Prefectural Park,36.0516,140.131,QM06bb,JP-IB,19,17,302,0,0
JP-1979,Kasumigaura Comprehensive Prefectural Park,36.0635,140.22,QM06cb,JP-IB,29,28,677,0,1
JP-1980,Ibaraki Airport Prefectural Park,36.1766,140.407,QM06ee,JP-IB,14,14,471,0,2
JP-1981,Gunma Ikoi-no-mori Prefectural Park,36.491,138.936,PM96ll,JP-GM,13,13,378,0,1
JP-1982,Shizuoka Performing Arts Prefectural Park,34.9809,138.449,PM94fx,JP-SZ,78,75,2522,0,4
JP-1983,Shizuoka Prefectural Public Forest Prefectural Park,35.2407,138.282,PM95df,JP-SZ,15,15,563,0,1
JP-1984,Kyoto Botanical Gardens Prefectural Park,35.049,135.763,PM75vb,JP-KY,4,4,125,0,0
JP-1985,Katsuragawa Sports Prefectural Park,34.9992,135.694,PM74ux,JP-KY,5,3,139,0,0
JP-1986,Wakagawa Riverside Prefectural Park,34.2046,135.18,PM74oe,JP-WK,5,5,117,0,0
JP-1987,Wakayama Prefecture Botanical Park Ryokka Center Prefectural Park,34.2858,135.328,PM74pg,JP-WK,7,6,154,0,1
JP-1988,Negoroyama Genkinomori Prefectural Park,34.2941,135.329,PM74ph,JP-WK,7,7,204,0,0
JP-1989,Gomadanzan Forest Prefectural Park,34.0406,135.566,PM74sa,JP-WK,6,6,183,0,0
JP-1990,Wakayama Prefecture Kii-fudoki-no-oka Museum of Archaeology and Folklore Prefectural Park,34.2283,135.23,PM74of,JP-WK,3,3,72,0,0
JP-1991,Maiko Prefectural Park,34.6308,135.034,PM74mp,JP-HG,9,9,269,0,0
JP-1992,Amagasaki no Mori Chuo Ryokuchi Prefectural Park,34.6954,135.382,PM74qq,JP-HG,18,16,424,0,0
JP-1993,Takarazuka Nishitani no Mori Prefectural Park,34.8984,135.296,PM74pv,JP-HG,14,12,274,0,2
JP-1994,Sasayama no Mori Prefectural Park,35.0594,135.361,PM75qb,JP-HG,3,3,54,0,0
JP-1995,Tamba Namikimichi Chuo Prefectural Park,35.0772,135.157,PM75nb,JP-HG,7,7,158,0,0
JP-1996,Awaji Ishi no Neya Ryokuchi Prefectural Park,34.5929,135.001,PM74mo,JP-HG,5,5,87,0,0
JP-1997,Miki Sogo Bosai Prefectural Park,34.7841,135.049,PM74ms,JP-HG,60,58,1689,0,1
JP-1998,Nishiina Prefectural Park,34.8008,135.418,PM74rt,JP-HG,13,12,252,0,0
JP-1999,Nadayama Ryokuchi Prefectural Park,34.5628,135.007,PM74mn,JP-HG,4,4,60,0,0
JP-2000,Awaji Hanasajiki Prefectural Park,34.5536,134.978,PM74ln,JP-HG,5,5,90,0,0
JP-2001,Yashiro Forest Prefectural Park,34.9081,135.04,PM74mv,JP-HG,28,27,598,0,1
JP-2002,"Naka,Yachiyo Forest Prefectural Park",35.0281,134.908,PM75ka,JP-HG,7,7,145,0,0
JP-2003,Yumesaki no Mori Prefectural Park,34.9376,134.664,PM74hw,JP-HG,4,4,106,0,0
JP-2004,Toga Art Prefectural Park,36.4324,137.043,PM86mk,JP-TY,4,4,113,0,0
JP-2005,Ishikawa Prefectural Forest Prefectural Park,36.6891,136.75,PM86jq,JP-IS,9,9,296,0,1
JP-2006,Konan Sports Prefectural Park,36.6326,136.674,PM86ip,JP-IS,15,15,347,0,1
JP-2007,Notojima Seaside Prefectural Park,37.1486,136.982,PM87ld,JP-IS,5,5,163,0,1
JP-2008,Yuuhidera Kenmin Nature Garden Prefectural Park,36.5724,136.707,PM86in,JP-IS,8,8,227,0,1
JP-2009,Ishikawa Kenmin-no-mori Prefectural Park,36.2246,136.456,PM86ff,JP-IS,5,4,109,0,0
JP-2010,Ishikawa Kenko-no-mori Prefectural Park,37.3089,136.93,PM87lh,JP-IS,5,5,172,0,0
JP-2011,Tottori Sakyu Kodomonokuni Prefectural Park,35.5338,134.224,PM75cm,JP-TT,5,5,165,0,0
JP-2012,Tottori Hanakairo-Flower Prefectural Park,35.348,133.424,PM65ri,JP-TT,4,4,129,0,0
JP-2013,Forest Park Tottori Deainomori Prefectural Park,35.4907,134.17,PM75cl,JP-TT,4,4,84,0,1
JP-2014,Forest Park 21st Century Prefectural Park,35.4168,134.207,PM75ck,JP-TT,4,4,113,0,0
JP-2015,Tottori Mukibanda Historic Site Prefectural Park,35.462,133.453,PM65rl,JP-TT,4,4,163,0,0
JP-2016,Miyajima Prefectural Park,34.2736,132.305,PM64dg,JP-HS,5,4,73,0,0
JP-2017,Ehime Kodomonoshiro Prefectural Park,33.7617,132.797,PM63js,JP-EH,5,5,71,0,0
JP-2018,Ehime Forest Prefectural Park,33.7501,132.74,PM63is,JP-EH,5,5,209,0,0
JP-2019,Miyazaki Seaside Prefectural Park,31.9299,131.468,PM51rw,JP-MZ,19,19,626,0,1
JP-2020,Miyazaki Prefectural Aoshima Subtropical Botanic Garden Prefectural Park,31.8018,131.47,PM51rt,JP-MZ,6,6,118,0,0
JP-2021,Lupinus Prefectural Park,32.1711,131.521,PM52se,JP-MZ,6,6,178,0,0
JP-2022,Kawaminami Yugaku no Mori National Park,32.2434,131.489,PM52rf,JP-MZ,7,6,197,0,1
JP-2023,Hinamoridai Kenmin Fureai no Mori Prefectural Park,31.9319,130.94,PM51lw,JP-MZ,6,6,283,0,1
JP-2024,Tomoni Manabu Mori Prefectural Park,31.9918,131.207,PM51ox,JP-MZ,5,5,123,0,0
JP-2025,The Shigaraki Ceramic Cultural Prefectural Park,34.8857,136.059,PM84av,JP-SH,10,9,300,0,1
JP-2026,Biwako Kodomonokuni Prefectural Park,35.3204,136.075,PM85ah,JP-SH,8,6,155,0,1
JP-2027,Shiga Prefecture Kibougaoka Cultural Prefectural Park,35.0543,136.068,PM85ab,JP-SH,8,8,182,0,1
JP-2028,Omifuji Karyoku Prefectural Park,35.0537,136.044,PM85ab,JP-SH,10,10,168,0,0
JP-2029,Hinomine Omiko Regional Prefectural Park,34.031,134.587,PM74ha,JP-TS,23,18,968,0,1
JP-2030,Naruto Uchinoumi Prefectural Park,34.21,134.597,PM74hf,JP-TS,9,9,335,0,0
JP-2031,Asutamu Land Tokushima Prefectural Park,34.153,134.441,PM74fd,JP-TS,6,6,164,0,0
JP-2032,Tokushima Prefectural Sanagouchi Ikimonofureainosato Prefectural Park,33.9687,134.414,PM73ex,JP-TS,4,4,249,0,1
JP-2033,Takamaruyama Sennennomori Prefectural Park,33.8818,134.332,PM73dv,JP-TS,3,3,170,0,0
JP-2034,Kuramoto Prefectural Park,34.0748,134.514,PM74gb,JP-TS,4,4,96,0,0
JP-2035,Shikoku Saburo No Sato Prefectural Park,34.0422,134.002,PM74ab,JP-TS,4,4,313,0,0
JP-2036,Tokushima Prefectural Dejima Wild Bird Garden Prefectural Park,33.9594,134.672,PM73ix,JP-TS,42,41,1213,0,1
JP-2037,Shinmachigawa Prefectural Park,34.0769,134.544,PM74gb,JP-TS,5,5,124,0,0
JP-2038,Imperial Palace Outer Garden National Government Park,35.6802,139.758,PM95vq,JP-TK,248,220,6343,0,14
JP-2039,Kyoto Gyoen National Government Park,35.0234,135.763,PM75va,JP-KY,6,5,131,0,0
JP-2040,Shinjuku Gyoen National Government Park,35.6852,139.71,PM95uq,JP-TK,64,57,1239,0,1
JP-2041,Donguri Land Prefectural Park,34.219,134.075,PM74af,JP-KG,8,7,138,0,1
JP-2042,Sanuki Kodomonokuni Prefectural Park,34.2121,134.017,PM74af,JP-KG,7,6,170,0,1
JP-2043,Sakaide Kansyo Ryokuchi Prefectural Park,34.3245,133.832,PM64vh,JP-KG,8,8,190,0,0
JP-2044,Setoohashi kinenkouen Prefectural Park,34.3514,133.826,PM64vi,JP-KG,12,10,270,0,1
JP-2045,Kagawayosui Memorial Prefectural Park,34.0992,133.765,PM64vc,JP-KG,7,7,221,0,0
JP-2046,Kozai Nishichiku Kowan Ryokuchi Prefectural Park,34.3579,133.996,PM64xi,JP-KG,10,9,205,0,0
JP-2047,Sanuki Airport Prefectural Park,34.2209,134.015,PM74af,JP-KG,7,6,124,0,0
JP-2048,Koutougawa Prefectural Park,34.3248,134.01,PM74ah,JP-KG,10,10,308,0,0
JP-2049,Olive Prefectural Park,34.4729,134.274,PM74dl,JP-KG,5,5,179,0,0
JP-2050,Dokigawa Prefectural Park,34.254,133.836,PM64wg,JP-KG,10,8,273,0,0
JP-2051,Ritsurin Garden Prefectural Park,34.3297,134.044,PM74ah,JP-KG,6,6,125,0,0
JP-2052,Ohno Odaiba Prefectural Park,36.617,136.606,PM86ho,JP-IS,13,13,308,0,0
JP-2053,Aomori Prefectural Sport Prefectural Park,40.8063,140.707,QN00it,JP-AO,12,11,338,0,1
JP-2054,Iwate Prefectural Sports Prefectural Park,39.7362,141.119,QM09nr,JP-IW,10,9,288,0,0
JP-2055,Fureai Ryokuchi Prefectural Park,40.1978,140.36,QN00ee,JP-AK,7,6,241,0,1
JP-2056,Toyama Nature Museum Prefectural Park,36.6391,137.082,PM86mp,JP-TY,5,5,130,0,1
JP-2057,Yatyou no sono Prefectural Park,36.6603,137.104,PM86np,JP-TY,4,4,105,0,2
JP-2058,Ranjyou no mori Prefectural Park,36.6366,137.047,PM86mp,JP-TY,6,6,227,0,1
JP-2059,Toyama 21st Century Forest Prefectural Park,36.428,137.084,PM86nk,JP-TY,4,4,107,0,0
JP-2060,Arimine Shinrin Bunka Prefectural Park,36.4915,137.459,PM86rl,JP-TY,3,3,139,0,0
JP-2061,Botanic Gardens of Toyama Prefectural Park,36.6628,137.181,PM86op,JP-TY,4,4,112,0,0
JP-2062,Kencho Mae Prefectural Park,36.6964,137.211,PM86oq,JP-TY,3,3,72,0,0
JP-2063,Rinkai Bird Prefectural Park,36.7823,137.105,PM86ns,JP-TY,5,5,130,0,1
JP-2064,Minami Suiro Ryokuchi Prefectural Park,36.7631,137.113,PM86ns,JP-TY,4,4,136,0,0
JP-2065,lumberyard Ryokuchi Prefectural Park,36.7702,137.097,PM86ns,JP-TY,5,5,117,0,1
JP-2066,Kaikou monument Ryokuchi Prefectural Park,36.7749,137.113,PM86ns,JP-TY,5,5,116,0,1
JP-2067,Genki no mori Prefectural Park,36.776,137.128,PM86ns,JP-TY,5,5,142,0,0
JP-2068,Ariake Shinsui Seaside Prefectural Park,35.6432,139.796,PM95vp,JP-TK,20,20,415,0,8
JP-2069,Harumi Greenway Prefectural Park,35.6506,139.779,PM95vp,JP-TK,29,27,610,0,2
JP-2070,Harumi Port Prefectural Park,35.6483,139.771,PM95vp,JP-TK,54,51,1773,0,13
JP-2071,National Ainu National Government Park,42.5599,141.365,QN02qn,JP-HK,6,6,196,0,0
JP-2072,Marine Park Nezugaseki Prefectural Park,38.5566,139.545,PM98sn,JP-YT,6,6,230,0,0
JP-2073,Yamizo Kenmin Recreation Prefectural Park,36.6993,140.073,QM06aq,JP-TC,10,9,281,0,0
JP-2074,Nerima-joshi Prefectural Park,35.7463,139.642,PM95tr,JP-TK,52,49,988,0,20
JP-2075,Umi-no-Mori Prefectural Park,35.6068,139.815,PM95vo,JP-TK,13,13,496,0,6
JP-2076,Kaiwomaru Prefectural Park,36.78,137.108,PM86ns,JP-TY,4,4,117,0,0
JP-2077,Tatsunokuchi Kyuuryou Prefectural Park,36.4381,136.546,PM86gk,JP-IS,5,5,265,0,0
JP-2078,Jyumoku Prefectural Park,36.431,136.641,PM86hk,JP-IS,7,7,179,0,0
JP-2079,Higashi Prefectural Park,36.6284,136.639,PM86hp,JP-IS,2,2,57,0,0
JP-2080,Minato Prefectural Park,36.6063,136.616,PM86ho,JP-IS,2,2,30,0,0
JP-2081,Goroujima Prefectural Park,36.617,136.624,PM86ho,JP-IS,3,3,104,0,0
JP-2082,Chikaokaryokuchi Prefectural Park,36.6121,136.628,PM86ho,JP-IS,7,7,235,0,0
JP-2083,Minato syou Prefectural Park,37.0489,136.977,PM87lb,JP-IS,2,2,49,0,0
JP-2084,Biwan Prefectural Park,37.0483,136.982,PM87lb,JP-IS,4,4,114,0,1
JP-2085,Nanao Marine Prefectural Park,37.0485,136.97,PM87lb,JP-IS,2,2,136,0,0
JP-2086,Togakushi Forest Botanical Garden Prefectural Park,36.752,138.077,PM96as,JP-NN,7,7,175,0,0
JP-2087,Ikuhisa Prefectural Park,36.0823,136.222,PM86cb,JP-FI,4,4,148,0,0
JP-2088,Fukui Undou Prefectural Park,36.0517,136.184,PM86cb,JP-FI,5,4,209,0,0
JP-2089,Tamba-no-Mori Prefectural Park,35.1222,135.072,PM75mc,JP-HG,5,5,102,0,0
JP-2090,Maruyamagawa Prefectural Park,35.6339,134.826,PM75jp,JP-HG,3,3,70,0,0
JP-2091,Kunimi-no-Mori Prefectural Park,34.986,134.523,PM74gx,JP-HG,3,3,66,0,0
JP-2092,Shimane Prefecutural Furusato Forest Prefectural Park,35.3859,132.894,PM65kj,JP-SM,5,5,127,0,0
JP-2093,Okayama Prefectural Forest Prefectural Park,35.2809,133.878,PM65wg,JP-OY,2,2,78,0,0
JP-2094,Yamaguchi Prefectural Seminar Prefectural Park,34.0604,131.436,PM54rb,JP-YC,3,3,74,0,0
JP-2095,Kirarahama Nature Observation Prefectural Park,34.0205,131.379,PM54qa,JP-YC,2,2,92,0,0
JP-2096,Hokigamine Forest Prefectural Park,33.6691,133.68,PM63uq,JP-KC,2,2,93,0,0
JP-2097,Kannourako Kaigan Ryokuchi Prefectural Park,33.5429,134.294,PM73dn,JP-KC,2,2,44,0,0
JP-2098,Teiko Kaigan Ryokuchi Prefectural Park,33.5348,133.752,PM63vm,JP-KC,3,3,127,0,0
JP-2099,Hijima Kotsu Prefectural Park,33.5734,133.551,PM63sn,JP-KC,3,3,80,0,0
JP-2100,Shiouji Kenmin No Mori Prefectural Park,33.5343,130.519,PM53gm,JP-FO,3,3,67,0,0
JP-2101,Yasu Kogen Kinen No Mori Prefectural Park,33.4914,130.658,PM53hl,JP-FO,3,3,64,0,0
JP-2102,Hadomisaki Kaihin Prefectural Park,33.5507,129.855,PM43wn,JP-SG,1,1,19,0,0
JP-2103,Nagasaki Kotsu Prefectural Park,32.7786,129.856,PM42ws,JP-NS,1,1,23,0,0
JP-2104,Amami Prefectural Park,28.4172,129.694,PL48uk,JP-KS,0,0,0,0,0
