reference,name,latitude,longitude,grid,locationDesc,attempts,activations,qsos,my_activations,my_hunted_qsos
JA-1505,Keihanna Commemorative Prefectural Park,34.7468,135.775,PM74vr,JP-KY,9,9,265,0,0
JA-1506,Tamba Prefectural Park,35.1654,135.416,PM75qd,JP-KY,5,5,175,0,0
JA-1507,Hokusetsu Prefectural Nature Park,34.9326,135.624,PM74tw,JP-OS,15,13,387,0,0
JA-1508,Hannan Misaki Prefectural Nature Park,34.3068,135.223,PM74oh,JP-OS,6,6,95,0,0
JA-1509,Hattori Ryokuchi Prefectural Park,34.7763,135.487,PM74rs,JP-OS,22,19,377,0,0
JA-1510,Neyagawa Prefectural Park,34.7613,135.652,PM74ts,JP-OS,7,7,180,0,0
JA-1511,Hiraoka Prefectural Park,34.674,135.655,PM74tq,JP-OS,16,10,197,0,1
JA-1512,Ishikawa Kasen Prefectural Park,34.5458,135.619,PM74tn,JP-OS,14,14,324,0,0
JA-1513,Oizumi Ryokuchi Prefectural Park,34.5644,135.528,PM74sn,JP-OS,19,17,550,0,2
JA-1514,Hamadera Prefectural Park,34.5393,135.439,PM74rm,JP-OS,10,10,293,0,0
JA-1515,Rinku Prefectural Park,34.4121,135.295,PM74pj,JP-OS,23,21,715,0,0
JA-1516,Tonboike Prefectural Park,34.4301,135.426,PM74rk,JP-OS,13,13,292,0,0
JA-1517,Sennan Satoumi Prefectural Park,34.3373,135.193,PM74oi,JP-OS,26,25,751,0,2
JA-1518,Yamadaike Prefectural Park,34.8219,135.691,PM74ut,JP-OS,9,9,275,0,1
JA-1519,Mino Prefectural Park,34.847,135.472,PM74ru,JP-OS,8,8,133,0,0
JA-1520,Fukakita Ryokuchi Prefectural Park,34.7262,135.629,PM74tr,JP-OS,8,8,190,0,0
JA-1521,Kyuhoji Ryokuchi Prefectural Park,34.6306,135.578,PM74sp,JP-OS,11,11,262,0,0
JA-1522,Suminoe Prefectural Park,34.6113,135.476,PM74ro,JP-OS,14,12,305,0,1
JA-1523,Sumiyoshi Prefectural Park,34.6124,135.488,PM74ro,JP-OS,11,9,134,0,0
JA-1524,Nishikori Prefectural Park,34.4824,135.572,PM74sl,JP-OS,6,6,121,0,0
JA-1525,Nagano Prefectural Park,34.4479,135.574,PM74sk,JP-OS,11,9,143,0,0
JA-1526,Nishiki no Hama Prefectural Park,34.4363,135.336,PM74qk,JP-OS,13,13,320,0,0
JA-1527,Izumisano Kyuryo Ryokuchi Prefectural Park,34.3674,135.331,PM74pi,JP-OS,12,12,276,0,0
JA-1528,Takirenzan Prefectural Nature Park,35.1238,135.242,PM75oc,JP-HG,10,7,210,0,0
JA-1529,Inagawa Keikoku Prefectural Nature Park,35.01,135.312,PM75pa,JP-HG,14,14,379,0,0
JA-1530,Kiyomizu Tojoko Tachikui Prefectural Nature Park,34.9272,135.068,PM74mw,JP-HG,15,14,388,0,1
JA-1531,Asago Gunzan Prefectural Nature Park,35.2338,134.88,PM75kf,JP-HG,5,5,171,0,0
JA-1532,Onzui Chikusa Prefectural Nature Park,35.2397,134.517,PM75gf,JP-HG,6,6,171,0,0
JA-1533,Tajima Sangaku Prefectural Nature Park,35.5367,134.629,PM75hm,JP-HG,5,5,226,0,0
JA-1534,Seiban Kyuryo Prefectural Nature Park,34.892,134.657,PM74hv,JP-HG,6,5,162,0,0
JA-1535,Izushi Itoi Prefectural Nature Park,35.3986,134.91,PM75kj,JP-HG,6,5,151,0,0
JA-1536,Harima Chubu Kyuryo Prefectural Nature Park,34.8403,134.896,PM74ku,JP-HG,13,13,412,0,0
JA-1537,Seppiko Mineyama Prefectural Nature Park,35.0633,134.666,PM75hb,JP-HG,8,7,287,0,0
JA-1538,Kasagatayama Sengamine Prefectural Nature Park,35.0636,134.835,PM75kb,JP-HG,6,6,204,0,0
JA-1539,Awajishima Prefectural Park,34.576,135.007,PM74mn,JP-HG,5,5,148,0,0
JA-1540,Arima Fuji Prefectural Park,34.9134,135.224,PM74ov,JP-HG,45,44,1254,0,1
JA-1542,Akashi Prefectural Park,34.6567,134.994,PM74lp,JP-HG,9,8,190,0,0
JA-1544,Ako Seaside Prefectural Park,34.7338,134.397,PM74er,JP-HG,3,3,74,0,0
JA-1545,Takasago Seaside Prefectural Park,34.7347,134.803,PM74jr,JP-HG,10,9,200,0,0
JA-1546,Kabutoyama Forest Prefectural Park,34.7724,135.335,PM74qs,JP-HG,35,27,653,0,0
JA-1547,Mikiyama Forest Prefectural Park,34.7882,134.989,PM74ls,JP-HG,20,18,512,0,1
JA-1548,Hyogo Park of the Oriental White Stork Prefectural Park,35.5512,134.854,PM75kn,JP-HG,5,5,111,0,0
JA-1549,Hitokura Prefectural Park,34.9145,135.419,PM74rv,JP-HG,11,11,281,0,0
JA-1550,Tajima Bokujyo Prefectural Park,35.5165,134.488,PM75fm,JP-HG,4,4,122,0,0
JA-1551,Harima Central Prefectural Park,34.9376,134.939,PM74lw,JP-HG,23,21,540,0,1
JA-1552,Ball Park Awaji Prefectural Park,34.4544,134.929,PM74lk,JP-HG,4,4,89,0,0
JA-1553,Flower Center Prefectural Park,34.9083,134.861,PM74kv,JP-HG,7,7,151,0,0
JA-1554,Yata Prefectural Nature Park,34.6627,135.737,PM74up,JP-NR,16,16,501,0,0
JA-1555,Tsukigase Konosan Prefectural Nature Park,34.6696,135.998,PM74xq,JP-NR,18,16,580,0,0
JA-1556,Yoshinogawa Tsuburo Prefectural Nature Park,34.3994,135.891,PM74wj,JP-NR,148,146,2337,0,5
JA-1557,Nara Prefectural Park,34.6847,135.843,PM74wq,JP-NR,12,10,188,0,0
JA-1558,Umami Kyuryo Prefectural Park,34.5626,135.737,PM74un,JP-NR,16,14,532,0,0
JA-1559,Obuchiike Prefectural Park,34.708,135.747,PM74uq,JP-NR,14,11,247,0,0
JA-1560,Mahoroba Kenko Prefectural Park,34.5975,135.783,PM74vo,JP-NR,13,13,433,0,0
JA-1561,Tatsuta Prefectural Park,34.6021,135.718,PM74uo,JP-NR,5,5,91,0,0
JA-1562,Yamato Minzoku Prefectural Park,34.6537,135.753,PM74vp,JP-NR,8,8,201,0,0
JA-1563,Kashihara Prefectural Park,34.4913,135.792,PM74vl,JP-NR,7,7,181,0,0
JA-1565,Uda Animal Prefectural Park,34.4891,135.932,PM74xl,JP-NR,8,6,159,0,0
JA-1566,Nara Palace Site Historical Prefectural Park,34.6866,135.793,PM74vq,JP-NR,12,10,147,0,0
JA-1567,Koyasan Choishimichi Tamagawakyo Prefectural Nature Park,34.2574,135.651,PM74tg,JP-WK,13,13,303,0,0
JA-1568,Ryumonzan Prefectural Nature Park,34.2482,135.413,PM74qf,JP-WK,5,5,83,0,0
JA-1569,Oishi Kogen Prefectural Nature Park,34.1065,135.327,PM74pc,JP-WK,9,9,257,0,0
JA-1570,Nishi Arida Prefectural Nature Park,34.0497,135.148,PM74nb,JP-WK,3,3,69,0,0
JA-1571,Shirasaki Kaigan Prefectural Nature Park,33.977,135.068,PM73mx,JP-WK,3,3,147,0,0
JA-1572,Enju Kaigan Prefectural Nature Park,33.8903,135.129,PM73nv,JP-WK,8,8,399,0,0
JA-1573,Jogamori Hokodai Prefectural Nature Park,34.0363,135.508,PM74sa,JP-WK,8,7,96,0,0
JA-1574,Hatenashi Sanmyaku Prefectural Nature Park,33.9026,135.689,PM73uv,JP-WK,2,2,29,0,0
JA-1575,Hikigawa Prefectural Nature Park,33.7361,135.573,PM73sr,JP-WK,2,2,27,0,0
JA-1576,Shiramisan Wadagawakyo Prefectural Nature Park,33.7596,135.878,PM73ws,JP-WK,1,1,16,0,0
JA-1577,Kozagawa Prefectural Nature Park,33.5453,135.721,PM73un,JP-WK,4,3,89,0,0
JA-1578,Kimiidera Prefectural Park,34.1665,135.191,PM74od,JP-WK,4,4,102,0,0
JA-1579,Kasei Prefectural Park,34.2474,135.125,PM74nf,JP-WK,7,6,124,0,0
JA-1580,Waka Prefectural Park,34.1813,135.174,PM74oe,JP-WK,8,8,227,0,0
JA-1581,Misasa Togoko Prefectural Nature Park,35.4654,133.891,PM65wl,JP-TT,8,8,227,0,0
JA-1582,Okuhino Prefectural Nature Park,35.2037,133.314,PM65pe,JP-TT,5,4,187,0,0
JA-1583,Nishi Inaba Prefectural Nature Park,35.0342,134.007,PM75aa,JP-TT,3,3,85,0,1
JA-1585,Lake Togo Hawai Seaside Prefectural Park,35.4919,133.886,PM65wl,JP-TT,6,6,187,0,0
JA-1586,Encho-en Prefectural Park,35.4658,133.893,PM65wl,JP-TT,4,3,82,0,0
JA-1587,Fuse Sports Prefectural Park,35.4991,134.182,PM75cl,JP-TT,5,5,206,0,0
JA-1588,Dandan Hiroba Prefectural Park,35.424,133.337,PM65qk,JP-TT,3,3,79,0,0
JA-1589,Kiyomizu Gassan Prefectural Nature Park,35.3612,133.185,PM65oi,JP-SM,6,6,229,0,0
JA-1590,Oni no Shitaburui Prefectural Nature Park,35.1749,133.018,PM65me,JP-SM,2,2,86,0,0
JA-1591,Shinjiko Kitayama Prefectural Nature Park,35.4462,132.867,PM65kk,JP-SM,14,11,322,0,0
JA-1592,Tachikuekyo Prefectural Nature Park,35.2955,132.735,PM65ih,JP-SM,3,3,115,0,0
JA-1593,Ryuzu Yaedaki Prefectural Nature Park,35.1558,132.809,PM65jd,JP-SM,8,8,584,0,0
JA-1594,Gokawa Suikei Prefectural Nature Park,35.0409,132.6,PM65ha,JP-SM,10,9,550,0,1
JA-1595,Dangyokei Kannondaki Prefectural Nature Park,34.9302,132.472,PM64fw,JP-SM,9,9,1203,0,0
JA-1596,Senjokei Prefectural Nature Park,34.9208,132.342,PM64ew,JP-SM,4,4,213,0,0
JA-1597,Hamada Kaigan Prefectural Nature Park,34.9473,132.109,PM64bw,JP-SM,11,11,736,0,0
JA-1598,Banryuko Prefectural Nature Park,34.6806,131.807,PM54vq,JP-SM,9,9,546,0,0
JA-1599,Aonoyama Prefectural Nature Park,34.4646,131.8,PM54vl,JP-SM,8,8,614,0,1
JA-1600,Hamayama Prefectural Park,35.3788,132.707,PM65ij,JP-SM,4,3,93,0,0
JA-1601,Iwami Seaside Prefectural Park,34.9579,132.144,PM64bw,JP-SM,9,9,585,0,0
JA-1602,Manyo Prefectural Park,34.679,131.814,PM54vq,JP-SM,6,6,277,0,0
JA-1603,Takahashigawa Joryu Prefectural Nature Park,34.9724,133.584,PM64tx,JP-OY,3,3,99,0,0
JA-1604,Kibi Shiseki Prefectural Nature Park,34.7285,133.766,PM64vr,JP-OY,7,6,166,0,0
JA-1605,Yubara Okutsu Prefectural Nature Park,35.2079,133.732,PM65ue,JP-OY,7,7,211,0,0
JA-1606,Kibiji Fudoki no Oka Prefectural Nature Park,34.6682,133.782,PM64vq,JP-OY,6,6,133,0,0
JA-1607,Bisaku Sanchi Prefectural Nature Park,35.122,133.537,PM65sc,JP-OY,2,2,119,0,0
JA-1608,Kibi Seiryu Prefectural Nature Park,34.8635,133.904,PM64wu,JP-OY,4,4,162,0,0
JA-1609,Yoshiigawa Churyu Prefectural Nature Park,34.932,134.212,PM74cw,JP-OY,3,3,109,0,0
JA-1610,Okayama Prefectural Multipurpose Grounds Prefectural Park,34.6787,133.917,PM64xq,JP-OY,6,6,160,0,0
JA-1611,Korakuen Prefectural Park,34.6678,133.936,PM64xq,JP-OY,5,5,170,0,0
JA-1612,Kurashiki Sports Prefectural Park,34.6193,133.805,PM64vo,JP-OY,6,6,142,0,1
JA-1613,Mizushima Ryokuchi Prefectural Park,34.5315,133.768,PM64vm,JP-OY,7,7,172,0,0
JA-1614,Nabarakyo Prefectural Nature Park,34.5643,132.513,PM64gn,JP-HS,4,4,165,0,0
JA-1615,Yamanokyo Prefectural Nature Park,34.6981,133.368,PM64qq,JP-HS,6,5,144,0,0
JA-1616,Mikuradake Prefectural Nature Park,34.3092,132.158,PM64bh,JP-HS,7,7,266,0,0
JA-1617,Chikurinji Yokurayama Prefectural Nature Park,34.4591,132.875,PM64kl,JP-HS,5,5,90,0,0
JA-1618,Buttsuji Mitsugi Hachimangu Prefectural Nature Park,34.4653,133.02,PM64ml,JP-HS,5,5,97,0,0
JA-1619,kannosekyo Prefectural Nature Park,34.9971,132.802,PM64jx,JP-HS,6,6,196,0,0
JA-1620,Hiroshimaken Sogo Ground Prefectural Park,34.3755,132.423,PM64fj,JP-HS,12,11,285,0,1
JA-1621,Shukkeien Garden Prefectural Park,34.3997,132.467,PM64fj,JP-HS,4,4,95,0,0
JA-1622,Hiroshima Ryokka Shokubutsu Prefectural Park,34.4355,132.566,PM64gk,JP-HS,11,11,434,0,1
JA-1623,Sera Kenmin Prefectural Park,34.6245,132.981,PM64lo,JP-HS,5,5,206,0,1
JA-1624,Miyoshi Prefectural Park,34.7982,132.905,PM64kt,JP-HS,8,8,363,0,0
JA-1625,Bingo Sports Prefectural Park,34.435,133.177,PM64ok,JP-HS,11,11,457,0,1
JA-1626,Chomonkyo Prefectural Nature Park,34.3177,131.569,PM54sh,JP-YC,6,6,468,0,0
JA-1627,Rakanzan Prefectural Nature Park,34.3504,132.052,PM64ai,JP-YC,11,11,436,0,0
JA-1628,Iwakisan Prefectural Nature Park,33.9872,132.038,PM63ax,JP-YC,6,6,375,0,0
JA-1629,Toyota Prefectural Nature Park,34.1767,131.044,PM54me,JP-YC,4,4,230,0,0
JA-1630,Ishin Hyakunen Prefectural Park,34.1562,131.437,PM54rd,JP-YC,2,2,75,0,0
JA-1631,Yamaguchi Kirara Expo Memorial Prefectural Park,34.005,131.372,PM54qa,JP-YC,3,3,89,0,0
JA-1632,Katazoegahama Kaihin Prefectural Park,33.8975,132.362,PM63ev,JP-YC,7,6,302,0,0
JA-1633,Hagi Wellness Prefectural Park,34.3862,131.422,PM54rj,JP-YC,3,3,178,0,0
JA-1634,Kameyama Prefectural Park,34.1808,131.474,PM54re,JP-YC,2,2,58,0,0
JA-1635,Hashikura Prefectural Nature Park,34.049,133.842,PM64wb,JP-TS,4,4,483,0,0
JA-1636,Dochu Kotsu Prefectural Nature Park,34.092,134.206,PM74cc,JP-TS,6,6,255,0,0
JA-1637,Oasayama Prefectural Nature Park,34.1861,134.5,PM74ge,JP-TS,7,7,390,0,0
JA-1638,Okuimiyagawauchidani Prefectural Nature Park,34.1479,134.354,PM74ed,JP-TS,10,9,373,0,0
JA-1639,Higashisankei Prefectural Nature Park,33.9627,134.511,PM73gx,JP-TS,46,42,3038,0,1
JA-1640,Chubusankei Prefectural Nature Park,33.9042,134.342,PM73ev,JP-TS,8,8,422,0,0
JA-1641,Seishonen no Mori Prefectural Park,33.8413,134.512,PM73gu,JP-TS,4,4,78,0,0
JA-1642,Bunkanomori Prefectural Park,34.0397,134.527,PM74ga,JP-TS,8,8,197,0,0
JA-1643,Kamiyama Shinrin Prefectural Park,34.0225,134.423,PM74fa,JP-TS,14,13,1016,0,1
JA-1644,Tsukimigaoka Kaihin Prefectural Park,34.1259,134.61,PM74hd,JP-TS,13,12,235,0,0
JA-1645,Naruto Sogo Undo Prefectural Park,34.1678,134.617,PM74he,JP-TS,7,7,185,0,0
JA-1646,Nanbu Kenko Undo Prefectural Park,33.8654,134.603,PM73hu,JP-TS,7,6,172,0,0
JA-1647,Otaki Daisen Prefectural Nature Park,34.1219,134.106,PM74bc,JP-KG,6,6,143,0,0
JA-1648,Mannoike Prefectural Park,34.1565,133.866,PM64wd,JP-KG,5,4,112,0,0
JA-1649,Kinbuchi Forest Prefectural Park,34.2406,134.108,PM74bf,JP-KG,21,3,147,0,1
JA-1650,Kikaku Prefectural Park,34.2527,134.183,PM74cg,JP-KG,5,4,122,0,0
JA-1651,Toryo Prefectural Park,34.2697,133.748,PM64ug,JP-KG,8,5,193,0,0
JA-1652,Kagawa Sports Prefectural Park,34.3651,133.96,PM64xi,JP-KG,6,5,192,0,0
JA-1653,Kinrin Prefectural Park,34.2864,134.255,PM74dg,JP-KG,4,4,104,0,0
JA-1654,Kinshako Prefectural Nature Park,33.9342,133.53,PM63sw,JP-EH,10,9,315,0,0
JA-1655,Okudogo Tamagawa Prefectural Nature Park,33.9333,132.923,PM63lw,JP-EH,5,5,155,0,0
JA-1656,Saragamine Renpo Prefectural Nature Park,33.7171,132.895,PM63kr,JP-EH,9,9,411,0,0
JA-1657,Shikoku Karst Prefectural Nature Park,33.4676,132.956,PM63ll,JP-EH,5,5,308,0,0
JA-1658,Hijikawa Prefectural Nature Park,33.453,132.686,PM63ik,JP-EH,3,3,128,0,1
JA-1659,Sadamisakihanto Uwakai Prefectural Nature Park,33.3891,132.084,PM63bj,JP-EH,3,3,132,0,0
JA-1660,Sasayama Prefectural Nature Park,33.0556,132.658,PM63hb,JP-EH,5,4,205,0,0
JA-1661,Dogo Prefectural Park,33.8482,132.787,PM63ju,JP-EH,4,4,69,0,0
JA-1662,Ehime Prefectural Sports Complex Prefectural Park,33.7674,132.797,PM63js,JP-EH,6,5,97,0,0
JA-1663,Nanyo Recreation Toshi Prefectural Park,32.9647,132.553,PM62gx,JP-EH,3,3,108,0,0
JA-1664,Teisumiyoshi Provincial Park,33.5207,133.755,PM63vm,JP-KC,4,3,83,0,0
JA-1665,Okumonobe Prefectural Nature Park,33.7635,134.031,PM73as,JP-KC,3,3,49,0,0
JA-1666,Shiragayama Prefectural Nature Park,33.8066,133.698,PM63ut,JP-KC,2,2,25,0,0
JA-1667,Yokogurayama Prefectural Nature Park,33.5348,133.203,PM63om,JP-KC,1,1,93,0,0
JA-1668,Yokonami Prefectural Nature Park,33.4122,133.428,PM63rj,JP-KC,2,2,118,0,0
JA-1669,Irino Prefectural Nature Park,33.0201,133.014,PM63ma,JP-KC,4,4,291,0,0
JA-1670,Sukumo Prefectural Nature Park,32.9181,132.688,PM62iw,JP-KC,4,4,276,0,0
JA-1671,Ryugado Prefectural Nature Park,33.6034,133.745,PM63uo,JP-KC,4,4,145,0,0
JA-1672,Nakatsu Keikoku Prefectural Nature Park,33.5645,133.11,PM63nn,JP-KC,1,1,107,0,0
JA-1673,Susakiwan Prefectural Nature Park,33.367,133.259,PM63pi,JP-KC,4,4,254,0,1
JA-1674,Okitsu Prefectural Nature Park,33.1548,133.223,PM63od,JP-KC,2,2,207,0,0
JA-1675,Yasui Keikoku Prefectural Nature Park,33.6689,133.191,PM63oq,JP-KC,1,1,100,0,0
JA-1676,Shikoku Karst Prefectural Nature Park,33.4657,132.956,PM63ll,JP-KC,1,1,60,0,0
JA-1677,Kitayama Prefectural Nature Park,33.6007,133.486,PM63ro,JP-KC,1,1,50,0,0
JA-1678,Yanase Prefectural Nature Park,33.6137,134.098,PM73bo,JP-KC,5,4,347,0,0
JA-1679,Kajigamori Prefectural Nature Park,33.7584,133.757,PM63vs,JP-KC,4,4,132,0,0
JA-1680,Washioyama Prefectural Nature Park,33.5291,133.513,PM63sm,JP-KC,3,3,112,0,0
JA-1681,Kuishiyama Jingamori Prefectural Nature Park,33.6867,133.441,PM63rq,JP-KC,2,2,23,0,0
JA-1682,Muroto Koiki Prefectural Park,33.2891,134.172,PM73cg,JP-KC,2,2,71,0,0
JA-1683,Haruno Athletic Recreation Prefectural Park,33.5103,133.502,PM63sm,JP-KC,2,2,35,0,0
JA-1684,Tosa Seinan Daikibo Prefectural Park,33.0242,133.016,PM63ma,JP-KC,2,2,90,0,0
JA-1685,Aki Koiki Prefectural Park,33.5228,133.913,PM63wm,JP-KC,1,1,26,0,0
JA-1686,Noichi Zoological Park of Kochi Prefecture Prefectural Park,33.5704,133.706,PM63un,JP-KC,2,2,37,0,0
JA-1687,Kochi Prefectural Park,33.5612,133.531,PM63sn,JP-KC,2,2,40,0,0
JA-1688,Godaisan Prefectural Park,33.5472,133.574,PM63sn,JP-KC,2,2,43,0,0
JA-1689,Tanezaki Sensho Prefectural Park,33.5036,133.57,PM63sm,JP-KC,1,1,17,0,0
JA-1690,Kagamino Prefectural Park,33.6189,133.719,PM63uo,JP-KC,2,2,40,0,0
JA-1691,Kagamikawa Ryokuchi Prefectural Park,33.5544,133.518,PM63sn,JP-KC,1,1,22,0,0
JA-1692,Kochi Kuko Midori no Hiroba Prefectural Park,33.537,133.681,PM63um,JP-KC,3,3,54,0,0
JA-1693,Ike Prefectural Park,33.5246,133.589,PM63tm,JP-KC,1,1,18,0,0
JA-1694,Dazaifu Prefectural Nature Park,33.5526,130.599,PM53hn,JP-FO,13,13,214,0,1
JA-1695,Chikuho Prefectural Nature Park,33.704,130.911,PM53kq,JP-FO,6,6,332,0,0
JA-1696,Chikugogawa Prefectural Nature Park,33.3517,130.79,PM53ji,JP-FO,2,2,48,0,0
JA-1697,Yabegawa Prefectural Nature Park,33.1757,130.77,PM53je,JP-FO,2,2,39,0,0
JA-1698,Sefuriraizan Prefectural Nature Park,33.4344,130.389,PM53ek,JP-FO,16,15,381,0,2
JA-1699,Higashi Prefectural Park,33.6058,130.42,PM53fo,JP-FO,2,1,13,0,0
JA-1700,Najima Undo Prefectural Park,33.6446,130.425,PM53fp,JP-FO,1,1,14,0,0
JA-1701,Nishi Prefectural Park,33.5981,130.375,PM53eo,JP-FO,6,6,107,0,0
JA-1702,Ohori Prefectural Park,33.5861,130.376,PM53eo,JP-FO,5,5,98,0,0
JA-1703,Tenjin Chuo Prefectural Park,33.5903,130.403,PM53eo,JP-FO,2,2,33,0,0
JA-1704,Central Prefectural Park,33.8762,130.839,PM53kv,JP-FO,6,6,290,0,0
JA-1705,Kasuga Prefectural Park,33.527,130.47,PM53fm,JP-FO,12,12,222,0,1
JA-1706,Chikuho Ryokuchi Prefectural Park,33.6581,130.748,PM53ip,JP-FO,4,4,153,0,0
JA-1707,Chikugo Regional Prefectural Park,33.1777,130.493,PM53fe,JP-FO,5,3,121,0,0
JA-1708,Kurokamiyama Prefectural Nature Park,33.2222,129.909,PM43wf,JP-SG,1,1,13,0,0
JA-1709,Taradake Prefectural Nature Park,32.977,130.09,PM52bx,JP-SG,2,2,25,0,0
JA-1710,Tenzan Prefectural Nature Park,33.346,130.135,PM53bi,JP-SG,4,4,154,0,0
JA-1711,Hachimandake Prefectural Nature Park,33.2823,130.027,PM53ag,JP-SG,3,3,81,0,0
JA-1712,Sefuri Hokusan Prefectural Nature Park,33.4321,130.251,PM53dk,JP-SG,3,2,66,0,0
JA-1713,Kawakami Kinryu Prefectural Nature Park,33.3498,130.299,PM53di,JP-SG,5,5,113,0,0
JA-1714,Yoshinogari Historical Prefectural Park,33.3242,130.384,PM53eh,JP-SG,5,5,150,0,0
JA-1715,Sagajo Prefectural Park,33.245,130.303,PM53df,JP-SG,4,3,60,0,0
JA-1716,Shinrin Prefectural Park,33.2402,130.249,PM53cf,JP-SG,2,2,26,0,0
JA-1717,Taradake Prefectural Nature Park,32.9481,130.088,PM52bw,JP-NS,7,7,558,0,0
JA-1718,Nomo Hanto Prefectural Nature Park,32.5589,129.78,PM42vn,JP-NS,6,4,99,0,0
JA-1719,Hokusho Prefectural Park,33.3067,129.664,PM43th,JP-NS,2,2,81,0,0
JA-1720,Omurawan Prefectural Park,33.0498,129.832,PM43vb,JP-NS,9,7,265,0,0
JA-1721,Nishisonogi Hanto Prefectural Nature Park,32.8099,129.737,PM42ut,JP-NS,4,3,63,0,0
JA-1722,Shimabara Hanto Prefectural Nature Park,32.6853,130.131,PM52bq,JP-NS,4,4,76,0,0
JA-1723,Hirado Prefectural Park,33.3581,129.568,PM43si,JP-NS,3,3,59,0,0
JA-1724,Tabira Prefectural Park,33.3544,129.576,PM43si,JP-NS,2,2,66,0,0
JA-1725,Saikaibashi Prefectural Park,33.0512,129.758,PM43vb,JP-NS,7,6,232,0,0
JA-1726,Nagasaki Sogo Undo Prefectural Park,32.8366,130.04,PM52au,JP-NS,3,2,38,0,0
JA-1727,Hyakkadai Prefectural Park,32.8155,130.296,PM52dt,JP-NS,3,2,35,0,0
JA-1728,Kinpozan Prefectural Nature Park,32.8167,130.643,PM52ht,JP-KM,5,3,59,0,0
JA-1729,Shotaizan Prefectural Nature Park,32.9788,130.514,PM52gx,JP-KM,1,1,12,0,0
JA-1730,Misumi Oyano Kaihen Prefectural Nature Park,32.607,130.47,PM52fo,JP-KM,4,4,102,0,0
JA-1731,Ashikita Kaigan Prefectural Nature Park,32.294,130.465,PM52fh,JP-KM,1,1,13,0,0
JA-1732,Yabe Shuhen Prefectural Nature Park,32.6818,130.994,PM52lq,JP-KM,2,1,20,0,0
JA-1733,Itsuki Gokanosho Prefectural Nature Park,32.5386,130.939,PM52lm,JP-KM,1,1,14,0,0
JA-1734,Okukuma Prefectural Nature Park,32.3172,131.095,PM52nh,JP-KM,2,2,85,0,0
JA-1735,Minamata Koiki Prefectural Park,32.2016,130.379,PM52ee,JP-KM,1,1,11,0,0
JA-1736,Techno Chuo Ryokuchi Prefectural Park,32.8222,130.844,PM52kt,JP-KM,3,3,74,0,0
JA-1737,Honmyojiyama Ryokuchi Prefectural Park,32.8221,130.676,PM52it,JP-KM,2,2,37,0,0
JA-1738,Mannichiyama Ryokuchi Prefectural Park,32.791,130.682,PM52is,JP-KM,3,3,98,0,0
JA-1739,Kumamoto Athletic Prefectural Park,32.8427,130.789,PM52ju,JP-KM,4,4,82,0,0
JA-1740,Yatsushiro Sports Prefectural Park,32.5331,130.556,PM52gm,JP-KM,2,2,32,0,0
JA-1741,Kunisaki Hanto Prefectural Nature Park,33.5643,131.569,PM53sn,JP-OT,13,11,697,0,1
JA-1742,Bungo Suido Prefectural Nature Park,33.0702,131.965,PM53xb,JP-OT,7,7,432,0,0
JA-1743,Jinkakuji Serikawa Prefectural Nature Park,33.0543,131.456,PM53rb,JP-OT,9,8,503,0,0
JA-1744,Tsue Sankei Prefectural Nature Park,33.1299,130.88,PM53kd,JP-OT,9,8,250,0,0
JA-1745,Sobo Katamuki Prefectural Nature Park,32.8971,131.605,PM52tv,JP-OT,5,5,324,0,0
JA-1746,Oita Sports Prefectural Park,33.2008,131.657,PM53te,JP-OT,5,5,110,0,0
JA-1747,Takaoyama Prefectural Park,33.2116,131.655,PM53tf,JP-OT,4,4,91,0,0
JA-1748,Osu Sogo Comrehensive Athletic Prefectural Park,33.2513,131.628,PM53tg,JP-OT,6,5,163,0,0
JA-1749,Sobo Katamuki Prefectural Nature Park,32.8323,131.472,PM52rt,JP-MZ,3,3,107,0,0
JA-1750,Osuzu Prefectural Nature Park,32.2878,131.465,PM52rg,JP-MZ,5,4,112,0,1
JA-1751,Saitobaru Sugiyasukyo Prefectural Nature Park,32.1534,131.365,PM52qd,JP-MZ,3,3,91,0,0
JA-1752,Mochio Sekinoo Prefectural Nature Park,31.762,130.987,PM51ls,JP-MZ,13,12,256,0,1
JA-1753,Wanitsuka Prefectural Nature Park,31.7686,131.269,PM51ps,JP-MZ,8,8,716,0,1
JA-1754,Yatake Kogen Prefectural Nature Park,32.0853,130.774,PM52jc,JP-MZ,1,1,36,0,0
JA-1755,Heiwadai Prefectural Park,31.9501,131.416,PM51qw,JP-MZ,10,9,251,0,0
JA-1756,Sogo Bunka Prefectural Park,31.934,131.419,PM51rw,JP-MZ,7,7,193,0,1
JA-1757,Miyazaki Prefectural Comprehensive Sports Prefectural Park,31.8274,131.445,PM51rt,JP-MZ,4,4,106,0,0
JA-1758,Saitobaru Burial Mounds Prefectural Park,32.1187,131.39,PM52qc,JP-MZ,4,4,121,0,0
JA-1759,Awakigahara Forest Prefectural Park,31.9445,131.467,PM51rw,JP-MZ,10,10,334,0,0
JA-1760,Akune Prefectural Nature Park,32.1054,130.176,PM52cc,JP-KS,4,4,63,0,0
JA-1761,Fukiagehama Kinpozan Prefectural Nature Park,31.521,130.326,PM51dm,JP-KS,4,4,82,0,0
JA-1762,Imutaike Prefectural Nature Park,31.8174,130.474,PM51ft,JP-KS,6,6,203,0,0
JA-1763,Bounoma Prefectural Nature Park,31.4217,130.123,PM51bk,JP-KS,7,6,149,0,0
JA-1764,Sendaigawa Ryuiki Prefectural Nature Park,31.9467,130.463,PM51fw,JP-KS,4,4,75,0,0
JA-1765,Takakumayama Prefectural Nature Park,31.486,130.819,PM51jl,JP-KS,15,15,600,0,1
JA-1766,Osumi Nanbu Prefectural Nature Park,31.0915,130.827,PM51jc,JP-KS,6,6,143,0,0
JA-1767,Tokara Retto Prefectural Nature Park,29.8592,129.858,PL49wu,JP-KS,0,0,0,0,0
JA-1768,Yoshino Prefectural Park,31.6318,130.593,PM51hp,JP-KS,3,3,50,0,0
JA-1769,Taniyama Ryokuchi Prefectural Park,31.5227,130.524,PM51gm,JP-KS,2,2,31,0,0
JA-1770,Kamoike Prefectural Nature Park,31.5657,130.559,PM51gn,JP-KS,10,9,155,0,0
JA-1771,Kamoike Ryokuchi Prefectural Park,31.5489,130.559,PM51gn,JP-KS,7,5,115,0,0
JA-1772,Fukiagehama Kaihin Prefectural Park,31.4365,130.283,PM51dk,JP-KS,2,2,25,0,0
JA-1773,Osumi Koiki Prefectural Park,31.2942,130.919,PM51lh,JP-KS,5,5,203,0,0
JA-1774,Ishibashi Kinen Prefectural Park,31.604,130.568,PM51go,JP-KS,5,5,102,0,0
JA-1775,Hokusatsu Koiki Prefectural Park,31.9028,130.438,PM51fv,JP-KS,4,4,103,0,0
JA-1776,Fureai Sports Land Prefectural Park,31.5493,130.491,PM51fn,JP-KS,3,3,52,0,0
JA-1777,Kumejima Prefectural Nature Park,26.3889,126.769,PL36jj,JP-ON,8,7,488,0,0
JA-1778,Irabu Prefectural Nature Park,24.8344,125.185,PL24ou,JP-ON,8,7,158,0,0
JA-1779,Tonaki Prefectural Nature Park,26.3628,127.15,PL36ni,JP-ON,1,1,10,0,0
JA-1780,Tarama Prefectural Nature Park,24.6637,124.696,PL24ip,JP-ON,1,1,21,0,0
JA-1781,Onoyama Prefectural Park,26.2037,127.675,PL36ue,JP-ON,5,3,42,0,0
JA-1782,Okinawa Comprehensive Athletic Prefectural Park,26.3095,127.823,PL36vh,JP-ON,12,11,200,0,1
JA-1783,Nago Chuo Prefectural Park,26.5878,127.992,PL36xo,JP-ON,4,4,148,0,1
JA-1784,Nakagusuku Prefectural Park,26.2881,127.793,PL36vg,JP-ON,25,25,377,0,0
JA-1785,Urasoe Dai Prefectural Park,26.25,127.729,PL36ug,JP-ON,14,12,177,0,0
JA-1786,Shurijo Castle Prefectural Park,26.2183,127.715,PL36uf,JP-ON,2,1,15,0,0
JA-1787,Kaigungo Prefectural Park,26.1857,127.675,PL36ue,JP-ON,2,2,23,0,0
JA-1788,Peace Memorial Prefectural Park,26.0962,127.724,PL36uc,JP-ON,5,5,112,0,0
JA-1789,Banna Prefectural Park,24.3747,124.16,PL24bi,JP-ON,7,5,115,0,0
JA-1790,Isehara Tounoyama Prefectural Park,35.3965,139.276,PM95pj,JP-KN,24,23,423,0,1
JA-1791,Yamakita Tsuburano Prefectural Park,35.3697,139.052,PM95mi,JP-KN,30,23,745,0,1
JA-1792,Odaiba Marine Prefectural Park,35.6299,139.775,PM95vp,JP-TK,32,28,590,0,0
JA-1793,Symbol Promenade Prefectural Park,35.6235,139.775,PM95vo,JP-TK,49,38,579,0,1
JA-1794,Aomi-Kita Port Prefectural Park,35.6191,139.774,PM95vo,JP-TK,18,18,333,0,1
JA-1795,Aomi-Minami Port Prefectural Park,35.6144,139.777,PM95vo,JP-TK,27,25,433,0,1
JA-1796,Akatsuki Port Prefectural Park,35.6082,139.791,PM95vo,JP-TK,25,23,572,0,1
JA-1797,Aomi Greenway Prefectural Park,35.6214,139.78,PM95vo,JP-TK,23,21,326,0,0
JA-1798,Aomi-Chuou Port Prefectural Park,35.6208,139.78,PM95vo,JP-TK,24,22,270,0,0
JA-1799,Mizu-no-Hiroba Prefectural Park,35.6278,139.788,PM95vp,JP-TK,47,43,729,0,1
JA-1800,Ariake Nishi Port Prefectural Park,35.6271,139.794,PM95vp,JP-TK,53,44,710,0,0
JA-1801,Ariake Kita Greenway Prefectural Park,35.6378,139.78,PM95vp,JP-TK,14,13,334,0,1
JA-1802,Ariake Tennis Prefectural Park,35.6354,139.788,PM95vp,JP-TK,24,21,389,0,0
JA-1803,Harumibashi Prefectural Park,35.6571,139.791,PM95vp,JP-TK,29,23,541,0,1
JA-1804,Higashi Yashio Greenway Prefectural Park,35.6193,139.772,PM95vo,JP-TK,24,23,437,0,1
JA-1805,Kasai Marine Prefectural Park,35.6387,139.855,PM95wp,JP-TK,18,15,352,0,0
JA-1806,Tatsumi-no-Mori Seaside Prefectural Park,35.6495,139.813,PM95vp,JP-TK,23,22,349,0,1
JA-1807,Shin-kiba Prefectural Park,35.6421,139.823,PM95vp,JP-TK,24,21,416,0,0
JA-1808,Tatsumi Greenway Prefectural Park,35.6457,139.813,PM95vp,JP-TK,23,23,504,0,2
JA-1809,Yumenoshima Greenway Prefectural Park,35.6477,139.831,PM95vp,JP-TK,32,24,438,0,0
JA-1810,Shin-kiba Greenway Prefectural Park,35.6401,139.841,PM95wp,JP-TK,20,19,320,0,0
JA-1811,Wakasu Seaside Prefectural Park,35.6134,139.836,PM95wo,JP-TK,24,24,537,0,0
JA-1812,Tokyo Port Wild Bird Prefectural Park,35.5839,139.761,PM95vo,JP-TK,21,19,345,0,1
JA-1813,Oi Port Central Seaside Prefectural Park,35.5934,139.75,PM95vo,JP-TK,31,28,530,0,0
JA-1814,Jonanjima Seaside Prefectural Park,35.5801,139.786,PM95vn,JP-TK,34,32,1018,0,0
JA-1815,Shinagawa Kita Port Prefectural Park,35.6304,139.755,PM95vp,JP-TK,12,12,193,0,0
JA-1816,Container Terminal Prefectural Park,35.6053,139.76,PM95vo,JP-TK,16,15,259,0,0
JA-1817,Jonanjima Port Prefectural Park,35.5791,139.773,PM95vn,JP-TK,15,14,217,0,1
JA-1818,Keihinjima Port Prefectural Park,35.5718,139.76,PM95vn,JP-TK,16,15,303,0,0
